f39e4880082f5579db49b29be735977a341c041b,RANGER-1394,Task,Ranger Release of 0.7.0,Ranger,Blocker
82509d969cb7c4c8c7092ce84b8f6ee91186af6c,RANGER-1394,Task,Ranger Release of 0.7.0,Ranger,Blocker
bc8ebde4a61aa1aee31403c0f2d43b2a4c07a8b3,RANGER-1380,Bug,not able to delete group that is having special character from ranger admin,Ranger,Critical
5eb030ada419c4b1aaff4474ac98b6680667efb0,RANGER-1347,Improvement,The AtlasClient should fall back to the plain password if the password decryption fails,plugins,Major
06005ca39b12bde4042804bf538ab855507c983f,RANGER-1391,Bug,Error occurred when use EndDate as Search Filter in Audit Access WebPage,admin,Major
869c723f126b7fa2b7c3aa796d805ec7e494de62,RANGER-1394,Task,Ranger Release of 0.7.0,Ranger,Blocker
509b316ef10e1c5a927b2662e337717ca23bae43,RANGER-1394,Task,Ranger Release of 0.7.0,Ranger,Blocker
5aceeaf0cf2c3eaf66f5a8b9d2736d24bde62b15,RANGER-1345,Bug,User group memberships are not updated properly in Ranger with Incremental LDAP/AD sync,Ranger,Major
4370b6b135ca5288bf25bd6f7a353b9699821099,RANGER-1389,Bug,ranger tagsync doesn&apos;t start when you create a truststore for it,tagsync,Major
da730073faaa0d426b9dded8b3c448cd44536f10,RANGER-1382,Bug,Good coding practice in Ranger recommended by static code analysis,plugins,Major
a7a631d5d8d102b5ae7eadb24e6781b3809d7d5b,RANGER-1341,Bug,Use credential provider files to store passwords rather storing them in config file in clear text format,Ranger,Major
0668f632700bdb35ec6e32a54c7713d7c91a66c4,RANGER-1379,Bug,Good coding practice for concurrent modification,Ranger,Major
59c5c9e856ddaf59dee9a2227b438375359ea650,RANGER-1381,Bug,Add hadoop-common.jar as dependency to ranger-hive-utils package to avoid build failure ,plugins,Major
bf29570d00db51e9ca6cfc27d7043b3ce10af1d8,RANGER-1375,Bug,HIVERangerAuthorizerTest UT fails intermittently,Ranger,Major
be582b59c2e459cefbe04dc01105c334a7ac216b,RANGER-1320,Bug,Ranger Hive Plugin Exception message correction,Ranger,Major
37a253d4f175d1fa1b8667d3125a7592e7918529,RANGER-1357,Bug,tag objects are not removed when attempting a full sync with Atlas tags,tagsync,Major
436b1fa9ed1b5c915129cd83017eef657aff25ac,RANGER-1366,Bug,Plugin-status page shows incorrect last-update time,admin,Major
3d158d51adf0deedd023aefdad026855459d8d57,RANGER-1310,Bug,Ranger Audit framework enhancement to provide an option to  allow audit records to be spooled to local disk first before sending it to destinations,None,Major
1cf39781ba54b78fb4544dfd02536bc300b1b5b3,RANGER-1361,Bug,RangerHDFSPlugin audits for Ancestor  Sub level and parent access doesn&apos;t have the correct accessType,plugins,Critical
ca2d2f9d7c338637f81878b902cf8955cb692a9e,RANGER-1355,Bug,Ranger HiveAuthorizer should check for ALTER permission for MSCK command while authorizing.,plugins,Major
46c446f23eba7b9bb9dd6721c117a96c2ffc64b7,RANGER-1365,Bug,Modify Ranger Hbase Plugin ColumnIterator to use Cell instead of KeyValue (to avoid ClassCastException in certain cases),Ranger,Critical
d7f73fe4243856c60f1260e72c2e1aec1f96f07a,RANGER-1362,Bug,The installer of the usersync and unixauthservice can be executed when JAVA_HOME environment variable was set empty. The result is that there are many errors when installing UserSync and unixauthservice. We should handle the exception as well as tagsync.,usersync,Minor
84b28e9a7137db73a029fd9164d5dffb32cb5d3b,RANGER-1367,Bug,No log was logged when some errors occurred in classes for the Unix Authentication Service.,Ranger,Minor
1bcb9ebe55746ae69bd1d099af678a8f24c0c2f2,RANGER-1363,Bug,BadCredentialsException when login,admin,Major
1ffe400869788cb83e9f418f303c964dfabf3a55,/,/,    Fixing typo,/,/
65f4de2bd69765f63ad95b82a742b2dbb769b273,RANGER-1359,Bug,Remove unnecessary spring dependency,admin,Minor
82189ab24fd6957b5e877a30ddefbfd5c9c1d0b1,RANGER-1356,Bug,The installer does not filter out comments lines for the configuration file when installing the Ranger UserSync Process and tagsync,usersync,Minor
8a398878a195b2bf2f260bd4019f544b0d6c30eb,RANGER-1352,Bug,few cases where even if JSON is invalid then also message appears IMPORTED SUCCSSFULLY,Ranger,Major
2135a00370e47d1b46b60d4c39dee82cb1c7fad7,RANGER-1345,Bug,User group memberships are not updated properly in Ranger with Incremental LDAP/AD sync,Ranger,Major
d6d5c2c3127f1d47a99637a95d34edb7559ee160,/,/,    Minor cleanup,/,/
701a368ada9d3fa0ea446fc6c238a1bfcf0ea1f9,/,/,    Cleanup,/,/
4dc8cc0b763779ee6a0f589285e7dd9d95391038,RANGER-1353,Bug,NameRules should be set to the default value in Kerberized Environment,Ranger,Major
70fc18099bd54c290aa832e3708c72f5307d7d55,RANGER-1293,Bug,There were logic errors in create_rangerdb_user and grant_xa_db_user function.,admin,Minor
90619aa108f4bca13f0679a66e3d6aff45ea9215,/,/,    Minor fixes,/,/
65bc6a51b8ba4c319515281e3b557f7f0b608a31,/,/,    Modified files from last commit,/,/
c4e078ecb44583303cead25fe85df78ecda6b545,/,/,    Logger should be private static final,/,/
6c9a84244ffbca2645d2ad190862d8287a01233b,RANGER-1349,Bug,Code block was iterated four times  in fact it should only be executed once during initializing InitD for ranger usersync process,usersync,Major
49af166e2a9427480c62d97d85810fc9119d4d7e,RANGER-1290,Bug,There was a logical error in parsing the configuration file when executing the database script.,admin,Minor
d55fad42315022931e210176fb339650181339be,RANGER-1338,Bug,Ranger Plugin failed to download policy when JaasConfig alone is used to set the UGI instead of Principal/Keytab,plugins,Major
223a14974c4614ecf0d0d537c62b5b1319d8d7b7,RANGER-1345,Bug,User group memberships are not updated properly in Ranger with Incremental LDAP/AD sync,Ranger,Major
5c2eee8ab4f64ea5d99c957f50827f3c186a82a1,/,/,    Updating website to use mirrors for the download release,/,/
987a8c0366c1c6a881a461127b8ac1bdf6d68724,RANGER-1344,Bug,The default sync interval is not enforced correctly for ranger usersync when sync source is AD/LDAP,Ranger,Major
9fea06dbb70adc2a0c33d5ab3b019064f571a141,RANGER-1317,Bug,There are two defects in install scripts for ranger usersync process,usersync,Major
306075df553e295041ef5b6e5b01a8a6799c9654,RANGER-1271,New Feature,RANGER-ATLAS testConnection feature,plugins,Major
4603dfa3de3921d1b6c6e1be10dfb82720896de6,RANGER-1338,Bug,Ranger Plugin failed to download policy when JaasConfig alone is used to set the UGI instead of Principal/Keytab,plugins,Major
4d9eca77698db58097b5266f71535a854d1b9bda,RANGER-1334,Bug,Good coding practices in Ranger Usersync ,usersync,Major
e3b0ce2d9760f9f85cddaea6adb1db4fb2abdaeb,RANGER-1325,Bug,Usernames starting with _ not allowed,admin,Minor
7fe9290b174121025960535ebccb2b0d91e1855e,RANGER-1336,Bug,audit based policy that has no policy item are not exported in CSV file,admin,Major
ed6488361660aecbba1d006f26218e5193995f8f,RANGER-1342,Bug,Hive test connection is not working,Ranger,Major
e64af0f51670b831dbb5d97f231df05269fff7a4,RANGER-1329,Bug,Update Ranger plugin handling of service-not-found error,plugins,Major
8f19bc5dddf4ad310c584dc2eebed614bb3e32bc,RANGER-1301,Task,Release Ranger 0.6.3,None,Critical
337eaac075594328cf8c95d0dbb775489c24027e,RANGER-1332,Task,Ranger TLP : Source Code / Script changes,documentation,Major
10d8f6a649f52230c85a7c3e2f3b53623892f814,RANGER-1335,Bug,Solr for Audit Setup breaks Solr versions 5.5 and above,audit,Major
16f481ba888077acb4daf5705896a8318aa6a24e,RANGER-1329,Bug,Update Ranger plugin handling of service-not-found error,plugins,Major
8f9fec37b0cf2c57b01a965453ef3976791b5a96,/,/,    Make the db setup scripts compatible with MacOS,/,/
82682d78296f0c9e83491de37ff64f4370c9bf55,/,/,    Merge branch 'master' of https://git-wip-us.apache.org/repos/asf/ranger,/,/
8719e58011e984cc0f421af722723e0a9d986b2e,RANGER-1332,Task,Ranger TLP : Source Code / Script changes,documentation,Major
05248d513f43a164820339b87b82481e871abf56,RANGER-1223,Bug,Ranger doesn&apos;t have the correct error message when audit configuration file is not present,None,Minor
de68fbdcee485dacbfa9a7f6841388cc475502d1,RANGER-1307,Bug,Enable Deny and Exclusions conditions in Ranger Policies for WASB service-def,Ranger,Major
28d2ed14d71185103168d407c5c2efb944fb44f0,RANGER-1332,Task,Ranger TLP : Source Code / Script changes,documentation,Major
1eb8938debd01c5c7aa5faf6c32179a0f2cddea5,RANGER-1330,Bug,When report exported in CSV format we get one random data in ID field,admin,Major
8ae952943926a00b2ce2a33690d553dc47472235,RANGER-1324,Bug,Analytics Metric for Ranger KMS usage,Ranger,Major
d5fee7873a15c914dc705e10dfe5ff03dca91b81,RANGER-1319,Bug,inconsistency in adding user to the DB table,Ranger,Major
bb322268a99b18d029030d0a7987f789b5cf8c48,RANGER-1316,Bug,Ranger-Admin enable security mode should not depend on configuration logdir,admin,Minor
2261a9dca231b4b3009fc96e362ac64f9f09ece3,RANGER-1211,Improvement, Improve Ranger Usersync to sync AD/LDAP users and/or groups incrementally.,usersync,Major
7a1c72262684a862f8df4ba908c5a2a918cb1f53,RANGER-1327,Improvement,Print details of any exception thrown when instantiating a custom Ranger condition evaluator,plugins,Major
2a3e15e4cfe7ec67d70a2b45e2598bd889bf6ff6,RANGER-1328,Bug,Test connection on tag service always returns &apos;connection failed&apos;,admin,Minor
eaef96be8f4ac96522cd25173146e3f3fbfa3b37,RANGER-1314,Improvement,Ranger enhancement to support authorization of namespace operations,plugins,Major
11aa58b634606908c217a23159c8a6d8c7733328,RANGER-1315,Bug,[export/import] if input file content is not valid for import then it does not give proper error  it gives null pointer exception in logs,Ranger,Major
51c340ec1d2cd7b0995215c89c5de1939e0ebe13,RANGER-1295,Bug,Add-ons to support WASB in Ranger Authorization Model,Ranger,Major
1a68c9586dcf74c4c0ed29035678d28a907ce94e,RANGER-1313,Bug,Fix issue found during coverity scan in one of the ranger usersync unit tests.,usersync,Minor
823f51fecd63c9d59690de225db224918a3d60d2,RANGER-1311,Bug,Ranger UI changes to support non-US characters in username related fields,admin,Major
c19ec875742665ab96577f5a27ebac2da036d3bc,RANGER-1308,Bug,Remove DEFAULT CHARSET &apos;latin1&apos; from ranger db schema script to enable support of unicode or any other charset ,Ranger,Major
6b03a286b188b98928251bce2637ba080f2f9f41,/,/,    Fixing coverity issues,/,/
1f855bcf94522f1c492859de92ce0ec7087e88ca,/,/,    Revert 92200a5f1feff2bea850a750b189b6b15b96c2fa,/,/
1796bc1f1d4ddd577f8ca8a515b16685c64ad955,/,/,    Revert 37035c36725a04a1f63a776c3037000e803672ca,/,/
e024d3cd36ecd66264ceaeaf35c7de0748a8d61b,/,/,    Revert 8ba81a6e35bb05dae7723138743ccba8c9654048,/,/
c008f391bfcd577b24388cf9fb6c2ff021a10238,/,/,    Revert 814ed7ee81a6f96ce10ee726d4e02838e178412a,/,/
6905ade8edae49e88a3a13cfe3bd53badc765ae9,RANGER-1312,Bug,The SYNC_SOURCE atribute only supports unix and ldap for ranger usersync at present  it&apos;s default value should be unix. Current the installation process directly exited because of using default configuration,usersync,Minor
607c341521a87876cc5efc920f2e97c3a2695f3b,RANGER-1199,Improvement,Optimize tag-download to include only tags that have policies,admin,Major
814ed7ee81a6f96ce10ee726d4e02838e178412a,RANGER-1316,Bug,Ranger-Admin enable security mode should not depend on configuration logdir,admin,Minor
ae4efea6db2df48fff182284ea65cd1a98ba5b6f,/,/,    Indentation cleanup,/,/
18406ea591c17c2e8c6d2e522ea8ac6fe7f6b21a,RANGER-1309,Improvement,Check for header first in RangerCSRFPreventionFilter,None,Trivial
07f0fee7c8cd8355d5c184ae772ac2aa7dd33563,RANGER-1273,Test,Add tests for Kafka + SASL_SSL + PLAIN,None,Major
b2774746c65f037d5bab2e04b6db24122abe9405,RANGER-1233,Improvement,TagSync to support Atlas notifications for HBase  Kafka entities,tagsync,Major
387aaf8a96070629a9e1a3014060731fa343f207,RANGER-1199,Improvement,Optimize tag-download to include only tags that have policies,admin,Major
2aca79045ea8892c569319ed552bc4157a9e58a9,RANGER-1288,Improvement,Add SSL enabled MySQL support in Ranger Admin,Ranger,Major
2fb94cc54e60e87d190f14f21f0d29f750894adf,RANGER-1304,Bug,Analytics Metric for Ranger usage,Ranger,Major
7e1c021bd039d450c4bcdf1056273eee46618cf7,RANGER-1305,Bug,If servicedef has blank configs : UI doesn&apos;t allow to add any configs to services of that servicedef,admin,Major
8ba81a6e35bb05dae7723138743ccba8c9654048,RANGER-1280,Bug,Currently the ranger-admin will be aborted and couldn&apos;t find any error messages in log file when the exception occured. We should get the default value instead of aborted and record the error log.,admin,Major
af3b31b5319613c82b12cc7bf411a935c03b8c69,/,/,    Indentation fix,/,/
688f1c09b918190f427cdcee08af1069605467c8,/,/,    Some indentation cleanup,/,/
da7ae44a644063de12faa7676197b8aa9980a38a,RANGER-1306,Bug,Exception logs were not logged in authenticate function for RangerAuthenticationProvider.java,admin,Minor
2afe8af3697257485c61426832ad290ff9dcc206,RANGER-1306,Bug,Exception logs were not logged in authenticate function for RangerAuthenticationProvider.java,admin,Minor
37035c36725a04a1f63a776c3037000e803672ca,/,/,    Some indentation cleanup,/,/
92200a5f1feff2bea850a750b189b6b15b96c2fa,RANGER-1287,Improvement,Remove code duplication from Java method EmbeddedServer.start(),admin,Minor
3031af53e6201b0cb94bf970e46baacf3e2451a9,/,/,    Updating NOTICE year,/,/
f895f2a5292a4cd46a5a8f0b69b71682bfe0c1d9,RANGER-1279,Bug,Make static variable RangerCSRFPreventionFilter.IS_CSRF_ENABLED private,None,Major
5357e9e5eee651cf2b464b421ec5272e959f0c86,RANGER-1278,Bug,Allow LDAP authentication without configuring group information,None,Major
0dc91ed3b089fdce99d63de4a3cbe71b9203f262,RANGER-1303,Bug,Ranger Knox lookup for service fails with null result,Ranger,Major
d77f02969c7567fc0fb57163724e18a0262134a6,RANGER-1302,Improvement,Support FILENAME and BASE_FILENAME tokens for HDFS plugin,plugins,Major
86b606571938658101886c0473701f95da031300,RANGER-1301,Task,Release Ranger 0.6.3,None,Critical
22029847559b3881cdc3176b15e545e847ef6d7c,RANGER-1261,Bug,Fix path matching inconsistencies and wildcard treatment,Ranger,Major
1ff41050015b7be736268f6c84e683121cfffd7b,RANGER-1297,Bug,Provide correct Ranger HiveAccessControlException message for DESCRIBE &lt;TABLE&gt; when authorization fails due to lack of SELECT on all columns,None,Major
b8dada7b01ab136b1c98ffb872f739eba5bc2f8b,RANGER-1227,Improvement,UI hints for Audit search for Ranger Audit Logs &amp; Policy Search on Policy Listing Page,admin,Major
31118afd4f0d10ad65faadfce69e0c2755cee030,RANGER-1285,New Feature,Ranger-Admin support storm HA  support the list of stormUIs when creating storm service.,admin,Minor
76867e570f23bd542d47a8cc0c27a8c51e41e7c9,RANGER-1170,Bug,Improvement of Unit Test coverage in Ranger,Ranger,Major
dd8a58177356408eef4df31b94a35a8c570e5464,RANGER-698,Improvement,Ranger policy should support variables like $user,None,Major
c599bbb4aa1c2948fbef9a1164a5a121de23ad8c,RANGER-698,Improvement,Ranger policy should support variables like $user,None,Major
9039504bc68e99dbb4459c4ee6b4bed14078c93f,RANGER-1170,Bug,Improvement of Unit Test coverage in Ranger,Ranger,Major
dc873cb29118738cb28981fc79b898e09da1ec56,RANGER-698,Improvement,Ranger policy should support variables like $user,None,Major
a38480fe35e878b0eb1b505bc978a8bc2432235c,RANGER-1112,Improvement,Remove &quot;Empty&quot; PMD restrictions,None,Major
8992c35df5d1b80c14c3ef1bb111af5c131c6536,RANGER-1090,Bug,Revoke command with grant option does not disable delegated admin permission for users/groups in the corresponding policy,Ranger,Major
c3a2b50c4d62987b101735087df40f7de97075de,RANGER-1099,Bug,keyadmin user is not able to create service/repo using public apis,admin,Critical
85093b8b4f99775d0ab08428d2184a77ec3da7f8,RANGER-1270,Bug,IndexOutOfBoundsException when test connection in Ranger-Solr-Plugin,None,Major
629e2007828db2e594379536802ba8503b179e88,RANGER-1284,Bug,Comment lines have not been filtered out when the populate_global_dict function parsed install.properties in security-admin/scripts/db_setup.py. ,admin,Major
988b2d7aad34fd3445ab4e70ae7460e3f103d6a0,RANGER-1276,Bug,User/Group search is failing due to encoding issues,Ranger,Major
001c91155a9439c26961277e68c355f86f49fec6,RANGER-1281,Bug,Provide option to filter KMS audits in Access Tab,admin,Major
31701840c03d2ecd87c282dae874c55865bcf907,RANGER-1210,Bug,Ranger Hive Plugin does not throw an exception when an INSERT/DELETE grant is issued from beeline,plugins,Minor
43e2f3d1358490390ed115cdf1f4cc841ad7d5a3,/,/,    fixed typo based on review comment,/,/
ed1670212422a7186974ecd8906393195017ce2c,RANGER-1224,Bug,Ranger UI: DN as Username,None,Major
1e2e04792975e30d942d208686b0483608639288,RANGER-1201,New Feature,Ranger admin support yarn HA  support standby yarn rest url configuration when creating yarn service. ,admin,Minor
68898eff03f33e6cf1468c72f32cb4ec2b2d4559,RANGER-1282,Bug,Good coding practice in Ranger recommended by static code analysis,Ranger,Major
4a565dfbc6661ea74abd70aed4d02e5bbe50bcf6,RANGER-1213,Bug,No check for wrong ROLEs set on a user,admin,Minor
57c88b548d74f775255fe94646f0b78de49b1af7,/,/,    Remove duplicate call to "getUnixAuthentication",/,/
6ba6af021e44d929fe77ef8fb60f0fe6a1c79b7b,/,/,    Removing "extends Object" call,/,/
fda9a01d049cd6c4c2b8eb525514293e4b2dc785,RANGER-1242,Bug,Create storm service with error configurations  test connection should not be successful.,admin,Minor
62689c3c80b7143309fa3de48202060926ac6025,RANGER-1275,Bug,At the beginning of the security-admin/scripts/setup.sh file there are three logical errors.,admin,Major
937613250e4d4793c3ab89ec82d1b28a0b57451b,/,/,    Delete the kafka log dir after the test run,/,/
e1993673264810611bf46914c948c225281ec5c1,RANGER-1272,Bug,The program doesn&apos;t check the RANGER_PID_DIR_PATH variables corresponding to the path in ranger-admin-services.sh file. The &quot;echo $VALUE_OF_PID &gt; ${pidf}&quot; failed when the path doesn&apos;t exist. ,admin,Major
2f77beafaa0bffe1e6bfc6e6597f1fff7b569e4d,RANGER-1274,Bug,Do some improvement for the error message in org.apache.ranger.biz.UserMgr.java file: add space between the sentences.,admin,Minor
263bf4353e6aceceac5d2e522e90eb09392514f1,RANGER-1230,Improvement,Policy versions in use for each Ranger plugin,admin,Major
510697aef5c782367d918020732b8e307f495909,RANGER-1259,Bug, Improve ChangePassword utility and make it idempotent for default password change request,Ranger,Major
0ef1622b997861b848c2ab9606932b4316421cbf,RANGER-1253,Bug,UI error when a special character is entered for a username in the admin webapp,admin,Major
fcb9a9bc9a48aac62b29f8b3cdf26c8326c7a9a7,RANGER-1251,Bug,when there is not tag based service associated with a reosurce based service then also it shows active and downloaded tag timestamp,Ranger,Critical
7676341a08664d7726c6aa31510255e90d56aa35,RANGER-1250,Bug,If non-existing access-permissions are added through curl then permission module shows loading icon.,Ranger,Major
ba5353df997f68ce224a26757a0cc71d5c3bbabc,RANGER-1244,Bug,Clarify in the process of accepting patches to ranger in README so github users are not confused.,None,Trivial
09b57de3b7d3e0365603f4bef8a8655463574913,RANGER-1243,Bug,One failed embedded ServiceDef creating prevent any service from being created in Ranger,Ranger,Major
9a9e6e8dc8028c0179f346f05c0ed121b99d72d6,RANGER-1268,Bug,Spelling error for &quot;RangerAtlasPluing&quot; in the ranger-atlas-plugin-shim/src/main/java/org/apache/ranger/authorization/atlas/authorizer/RangerAtlasAuthorizer.java. &quot;RangerAtlasPlugin&quot; instead of &quot;RangerAtlasPluing&quot;.,plugins,Minor
1ee7025fa6864089df22ccbabc4d860755623bf8,RANGER-1267,Bug,Spelling error for &quot;RangerKafkaPluing&quot; in the ranger-kafka-plugin-shim/src/main/java/org/apache/ranger/authorization/kafka/authorizer/RangerKafkaAuthorizer.java. &quot;RangerKafkaPlugin&quot; instead of &quot;RangerKafkaPluing&quot;.,plugins,Minor
c51d7900c185395c8b4a18220f7aaec66197d21b,RANGER-1266,Bug,Spelling error for &quot;RangerYarnPluing&quot; in the ranger-yarn-plugin-shim/src/main/java/org/apache/ranger/authorization/yarn/authorizer/RangerYarnAuthorizer.java. &quot;RangerYarnPlugin&quot; instead of &quot;RangerYarnPluing&quot;.,plugins,Minor
bf649f0978159cfe8021fa2aa35b4a76e9d7d93b,RANGER-1265,Bug,Spelling error for &quot;RangerHdfsPluing&quot; in the ranger-hdfs-plugin-shim/src/main/java/org/apache/ranger/authorization/hadoop/RangerHdfsAuthorizer.java. &quot;RangerHdfsPlugin&quot; instead of &quot;RangerHdfsPluing&quot;.,plugins,Minor
45f145093338a1604015ec53670de4384722c530,RANGER-1264,Bug,Spelling error for &quot;Pluing&quot; in the agents-common/src/main/java/org/apache/ranger/authorization/hadoop/config/RangerConfiguration.java. &quot;Plugin&quot; instead of &quot;Pluing&quot;.,plugins,Minor
11e869f42330a00771ab200ad9e0e176cbd7787a,RANGER-1263,Bug,Spelling error for &quot;RangerHdfsPluing&quot; in the ranger-hbase-plugin-shim/src/main/java/org/apache/ranger/authorization/hbase/RangerAuthorizationCoprocessor.java. &quot;RangerHbasePlugin&quot; instead of &quot;RangerHdfsPluing&quot;.,plugins,Minor
5e7b555cd44e48f76c4b9939a3504459b9ab9523,RANGER-1255,Bug,Policy engine initialization must be resilient to invalid values in the downloaded policies JSON,Ranger,Major
18e248a4c8a52ff61fccc1dede3dac41e2c615e0,/,/,    Spelling corrections,/,/
dac747548fccb60fe9ff632e5cf66517414385f2,/,/,    correct spelling,/,/
32168d60dc3e0a44c9585a67100c9da8cc7b84e0,RANGER-1257,Bug,Spelling error for &quot;redireting&quot; in the  knox-agent/src/main/java/org/apache/ranger/authorization/knox/RangerPDPKnoxFilter.java. &quot;redirecting&quot;  instead of &quot;redireting&quot;.,plugins,Minor
72ebe7c248a8c2bbc319146885cfb7cc21d92c81,RANGER-1257,Bug,Spelling error for &quot;redireting&quot; in the  knox-agent/src/main/java/org/apache/ranger/authorization/knox/RangerPDPKnoxFilter.java. &quot;redirecting&quot;  instead of &quot;redireting&quot;.,plugins,Minor
7901d43c21d3e392c2f88ed40c22d5c84e227fac,RANGER-1251,Bug,when there is not tag based service associated with a reosurce based service then also it shows active and downloaded tag timestamp,Ranger,Critical
a1dd7be65d9e0ac82b45aa6cb357a657ecab8c4f,RANGER-1256,Bug,Ranger Plugin Status does not display IP address of plugin if Ranger is in HA mode,admin,Major
043daf31b3310d7a2f7bab1f81cfbeb99232bb35,RANGER-1254,Bug,HiveAuthorizer should deny access to URI operations if there are any exceptions ,Ranger,Major
ebcf9dd5e8c35a12b84405067bb7db0c5c3596c6,RANGER-1237,Bug,Ranger permissions do not load when there are bulk users,Ranger,Critical
b995253899ef6e204be70473e6ed94764f25107b,RANGER-1249,Bug,Ranger admin service should run with &apos;UTC&apos; default timezone,Ranger,Major
4148631896dc6576ccc7e9d6eaaeca375c7ce3b8,RANGER-1254,Bug,HiveAuthorizer should deny access to URI operations if there are any exceptions ,Ranger,Major
c0398aaca1c6b00fc82734d896a560066b73a6bc,RANGER-1254,Bug,HiveAuthorizer should deny access to URI operations if there are any exceptions ,Ranger,Major
fdc3148b9ddab85d489b9bb0b7bbad54b7499790,RANGER-1232,Bug,Spelling error for StromTopologyName  should be StormTopologyName,Ranger,Minor
964253905c0b6d893748180a44d02c13aee851df,RANGER-1232,Bug,Spelling error for StromTopologyName  should be StormTopologyName,Ranger,Minor
a51da0013e82dd2e416991704a745fbe5d1ef47f,/,/,    Trivial whitespace/spelling mistake changes,/,/
d3d03a10d6bf30857d50efdc6a6f8cc9fc829397,RANGER-1241,Bug,PID file generation improvement ,admin,Major
36da4241c2c81d6b5fe4d06b9312f1e19060f1f2,RANGER-1245,Bug,Ranger UI group name limitation (32 characters in UI),admin,Major
d8f4b2eab64c902e9e2018c25ef11f2a88acb2b6,RANGER-1195,Improvement,Ranger should allow for &quot;Show Columns&quot; and &quot;describe&quot; on tables where user access is limited to a subset of columns.,plugins,Major
10f2befe97f597ebef7cc7ad032e833633905117,/,/,    Add latest policy and tag info to RangerPluginInfo,/,/
883666c6755d6f291650f17ad81ef2e0c87ad872,RANGER-1240,Bug,Remove tab characters from README.md,documentation,Trivial
39b23e5a6cd6185c45853e43af72e6eb2f68f5cd,RANGER-1239,Bug,hbase policy created as a result of hbase grant request does not allow dropping the namespace for the grantee user,plugins,Major
3989b67816807c254edeaccbbd1ba0b3f454fe83,RANGER-1238,Bug,Update library versions in tagsync to keep in-sync with Atlas,tagsync,Major
2465befcaf594c91e9c0124209d3137db04fe476,RANGER-1230,Improvement,Policy versions in use for each Ranger plugin,admin,Major
e3a4d80b0adba24aa6eea5556a1928b468aefb8b,RANGER-1229,Bug,RangerResourceMatcher for Hdfs and Yarn resources does not correctly handle policy containing only one resource whose value is &quot;*&quot;,plugins,Major
d328d023ef69bf0c2952a461c547f2a9ff7fb722,RANGER-1227,Improvement,UI hints for Audit search for Ranger Audit Logs &amp; Policy Search on Policy Listing Page,admin,Major
de8f444d27eebfa633ad88e14811bfc1e5d39bd7,RANGER-1233,Improvement,TagSync to support Atlas notifications for HBase  Kafka entities,tagsync,Major
62160bb81c964fc829b6916f9054faefd1ddfa63,RANGER-1229,Bug,RangerResourceMatcher for Hdfs and Yarn resources does not correctly handle policy containing only one resource whose value is &quot;*&quot;,plugins,Major
a15af08cab65ae631b1a853b6de8fa613925b1fa,RANGER-1206,Bug,Modifications to install scripts to skip checking of DB and java patches in each install ,Ranger,Major
a6e0eb908e932ace080d2b9c9244be9e0727d2ee,RANGER-1222,Bug,Unit test failure in TestDefaultPolicyResourceMatcher (Java 8),None,Major
b4651bc83682758a79659f6ea205b3f5b86408e7,RANGER-1206,Bug,Modifications to install scripts to skip checking of DB and java patches in each install ,Ranger,Major
2ed2a009beda2e9c2aea01fa16b9404235a90d2e,RANGER-1216,Bug,Ranger Audit framework fails to audit to kerberized +  SSL enabled Solr ,Ranger,Major
ae8e485f88700ae1f830ac406322e5d94c750864,RANGER-1215,Bug,Add joda-time library to list of libraries packaged with tagsync,tagsync,Major
d61ef2a0438fd69a9595ddd192bf1b9a01c121d1,RANGER-1192,Bug,Ranger PID file not being read if a custom location is provided,Ranger,Major
