252af49103e8a93517b402be31d7c2822204ff73,RANGER-1932,Bug,After create the service of yarndev the policy named &apos;all-queue&apos; created for the default user should have all the permissions.However  this policy does&apos;t take effect.,plugins,Major
12d9e21ac27edb5a23c7505ecb07b47c987bcbdd,RANGER-1938,Improvement,Solr for Audit setup doesn&apos;t use DocValues effectively,audit,Major
a1c14e3507981968e366924667fa47079208dfda,RANGER-1943,Bug,Ranger Solr authorization is skipped when collection is empty or null,Ranger,Critical
4ef52b46b1e6dd7bc1991a05b8256984d30a6c58,RANGER-1929,New Feature,The ranger should support the View policy.,admin,Major
3e1168ddb6b322d57d56ebc5c8d87b006df15aa6,RANGER-1932,Bug,After create the service of yarndev the policy named &apos;all-queue&apos; created for the default user should have all the permissions.However  this policy does&apos;t take effect.,plugins,Major
52a303218224610d4b7b34f745bacfadaea1420c,RANGER-1934,Bug,Optimize the init method in BaseAuditHandler class to avoid ArrayIndexOutOfBoundsException,audit,Minor
f1fb6315f0d4cbc1c32b93d7951fb99ea376c73a,RANGER-1781,Bug,RangerUI :Policy create/edit form should display only relevant accesses based on the user-selected resource.,Ranger,Major
6841f14d563e00e3f94c4dc979528c885d1f1dfe,RANGER-1940,Improvement,Upgrade to Knox 1.0.0,plugins,Major
567d2c9149dbb625ba65d2668178210eaf1932a2,RANGER-1940,Improvement,Upgrade to Knox 1.0.0,plugins,Major
e71b452f68104922c3c49e18ce99b5d86d9f1084,RANGER-1936,Improvement,Upgrade Ranger to use Java 1.8,plugins,Major
bd3c1bc7b4869957a3e33320831da0f4938daafe,RANGER-1933,Improvement,Improvement on Ranger-usersync log configuration,Ranger,Major
bba925d48e6381b40c34f3364aa34020a984e284,RANGER-1905,Bug,NoClassDefFoundError from the built zip/tar.gz  created by the maven-assembly-plugin,admin,Blocker
 ,RANGER-1858,Bug,ranger-admin start fail when policymgr_http_enabled equal to false.,admin,Critical
46164b7514891c67e617ec64bbd770668ef79c89,RANGER-1827,Test,micro benchmark for policy evaluation,Ranger,Minor
0e5b0775258a251d1846dd9622f234b8b46df742,RANGER-1927,Improvement,Upgrade Hive to 2.3.2,plugins,Minor
ca8f0b76404db53a4b0bdb4f697d14e7adeff175,RANGER-1926,Improvement,Upgrade Storm dependency to 1.1.1,plugins,Minor
dec65f164f06c04947c1823f91da7482f9a8067e,RANGER-1931,Bug,Remove use of maven-shade-plugin from Ranger build scripts,Ranger,Major
cd67d7295a95049646c44c3bcf1fdd04895eff5d,RANGER-1924,Improvement,Simplify ranger-hdfs plugin remove gson.jar in ranger/src/main/assembly/hdfs-agent.xml ,plugins,Minor
d1ee6a578e4d3268bdb220cdb73f481d7403fbc2,RANGER-1925,Improvement,Remove invalid code from plugin script.,plugins,Major
58f513215da421a4015e2d080e88d8fdacad3471,RANGER-1920,Improvement,Remove SOLR dependencies from the KMS service + plugins,plugins,Major
30b8ddfbdc946c4a3e07da0121c29e0da1db2587,RANGER-1923,Improvement,Simplify Hive dependencies,plugins,Minor
59b457a451fd0d1b78b658405ad936b5f6f3135a,RANGER-1922,Improvement,Simplify HBase dependencies,plugins,Major
c4020f89b929f323d133fbe81d2571deca29f934,/,/,    Add myself to the commiter list,/,/
d22398bb4e5ef2efe15d9d55e56e08c0bf37a8b6,/,/,    Adding website link to wiki security advisories page,/,/
b8c70c41b9728f9abb22b8cde66cc09ee8dc0845,RANGER-1849,Improvement,Remove PasswordGenerator and FileStoreUtil,plugins,Trivial
e8afb9faad81e7042877aa528635848a0043cb0c,RANGER-1897,Bug,TagSync should replace use of V1 Atlas APIs with V2 APIs for efficient tag-download from Atlas,tagsync,Major
c7260c3eeee0b9f33f01a166b1be5ee6540a10d7,RANGER-1827,Test,micro benchmark for policy evaluation,Ranger,Minor
e2c52d62b100e0ed2b2ce3e47dc8a9ee0aab19d6,RANGER-1893,Improvement,Update HBase dependency to 1.2.6,plugins,Major
f79737bb284fd0671a6ad05ccc4c1d16fd4e1603,RANGER-1912,Bug,Ranger setup fails with mariadb/mysql when binary logging is enabled,Ranger,Major
2fa6f6ce6255e3a49756a02c65a018b61d1ad9f4,/,/,    Fix Coverity scan warnings in RangerHdfsAuthorizer,/,/
9750aa3d96336a352a7219cd9041978532642009,/,/,    Fix problems in RangerKMSDB initializetion  remove unnecessary code  simplify a bit,/,/
c806d17779144df3d0c60402a03cb167e69c1582,RANGER-1827,Test,micro benchmark for policy evaluation,Ranger,Minor
291bb3e9c2e67a5bacad40f397382e6b896f96a2,RANGER-1867,Improvement,Update nimbus-jose-jwt to 4.41.2,admin,Major
87428c93c69abf834b9d0814210a9493e5390c1f,RANGER-1898,Bug,Simplify Knox plugin dependency management,plugins,Minor
d7557cd01e3a7aacc295c297655753923ac7599a,RANGER-1917,Improvement,Remove solr dependency from Kafka + Sqoop modules,plugins,Major
03b052e2ca543ef4724f7b23807ee9bebf0ff34c,RANGER-1906,Improvement,Simplify Atlas plugin dependency management,plugins,Minor
650b24e5d38c20c20869c0158ed9f35818e79bd0,RANGER-1915,Improvement,Optimize the code and keep the code style consistent in the RangerAdminRESTClient class,admin,Major
44538159464b1357ed6862c5462ae7a4d48a0b8b,RANGER-1916,Improvement,Remove duplicate code and optimize code in AtlasClient.class,plugins,Minor
9260e0de099d1c4c092c276217088b7512db134a,RANGER-1797,Bug,Tomcat Security Vulnerability Alert. The version of the tomcat for ranger should upgrade to 7.0.82.,admin,Major
370cb4fc6c634f5eaccb91727ae8fe1b2b262ea1,RANGER-1707,Bug, Update RangerHdfsAuthorizer for changes in traverse checks since Hadoop 2.8,plugins,Major
879a4dfddca4218148a738ef20001b020f4b9f3e,RANGER-1914,Bug,Modify crypt_algo_array.length to avoid java.lang.ArrayIndexOutOfBoundsException in PasswordUtils.class,Ranger,Minor
fb0b6f6abd06ad051d53fe67ed62a2aaedf518ed,RANGER-1907,Improvement,The solr-solrj jar is not need for hive-agent. So it should be removed from the pom.xml file of the hive-agent,plugins,Minor
4c2bed53607de1fe8d3565f7a79dc807f6a5008a,RANGER-1910,Improvement,Simplify the maven dependency management of the Yarn plugin for Ranger .solr-solrj can be removed from the pom.xml file of the plugin-yarn,plugins,Minor
1e77fa2a4be3425f97d5711ebb0de5db8258c618,RANGER-1781,Bug,RangerUI :Policy create/edit form should display only relevant accesses based on the user-selected resource.,Ranger,Major
b70479c4fe1abadf9d94d07a995e0c988dc5ad1c,RANGER-1895,Improvement,Simplify Storm dependencies,plugins,Minor
21f8b63f5d0c6e422bc19adb515ba8a542955ab5,RANGER-1901,Bug,Similar to RANGER-1846  the JAVA_VERSION_REQUIRED configuration item is invalid in kms installer  we should enable it to control the necessary java version.,kms,Minor
 ,RANGER-1846,Bug,This JAVA_VERSION_REQUIRED configuration item is invalid in security admin installer  we should enable it to control the necessary java version.,admin,Major
5824fdc819bf41736ec5d2798ffaa7aba24c8cc7,RANGER-1903,Bug,Simplify the maven dependency management of the Hdfs plugin for Ranger.,plugins,Minor
906613684d0662b22448435fe794b08b217d7021,RANGER-1887,Bug, serviceDef.getResources().get(0).getName(); case IndexOutOfBoundsException in RangerServiceTag.class And  print error in RangerServiceStorm,plugins,Minor
ad2731811d56a2fa357cf06bea5e5c2f1fc1b98d,RANGER-1848,Sub-task,Implement getLinkList/getJobList in SqoopClient for Ranger Sqoop2 plugin,admin,Major
41e220381fecb3fcb184b0227152f4e77078ab1c,/,/,    Remove deprecated extractedCommonCriterias call from the SearchUtil and fix the UserREST controller,/,/
8ab766846538ddcb3dd56dc11c174c6a8e3ad83c,RANGER-1861,Bug,There are errors when the &quot;ranger-kms start&quot; command was executed.,kms,Major
10051777edf21c5ab7914c0670e23040d105dc4c,RANGER-1883,Bug,TagSync should reuse kerberos ticket in REST calls to Ranger Admin,tagsync,Major
6f4e28639ad431cc0073e1af4ed591035d92b734,RANGER-1877,Improvement,The ranger policies json file should be formatted when exported  at ranger service manager. ,Ranger,Minor
81d1584a2c8337e5fca81bf5cc237c3e66666e4e,RANGER-1781,Bug,RangerUI :Policy create/edit form should display only relevant accesses based on the user-selected resource.,Ranger,Major
e65235d1cb52267be16d6b033532d88692fde12f,RANGER-1860,Bug,Provide a new service interface prompt function framework to resolved the defect of the current service interface  increase the flexibility of the function  improve user ease of use,admin,Major
58fc47e6247500f8c67c55d933ce99c3c47a97ef,RANGER-1884,Bug,Default Policy is not created for Ranger KMS and Tag service,Ranger,Critical
576b62ad0e9ec4ae6de270a4531eb7eb162d6d8e,/,/,    Reduce code duplication in kms  where the console handling code is repeated 4 times.,/,/
98cb80e3335e7c9588b9ad5b57667d3421fba4e6,RANGER-1883,Bug,TagSync should reuse kerberos ticket in REST calls to Ranger Admin,tagsync,Major
2a1406df8125b96b3051616cb61ba01fc96f93c3,RANGER-1781,Bug,RangerUI :Policy create/edit form should display only relevant accesses based on the user-selected resource.,Ranger,Major
0688f5eb7378a120830571260bf483949ccd4a74,RANGER-1880,Bug,TagSync update to process TRAIT_UPDATE notification from Atlas,tagsync,Major
f8931ff65721a49cfd7998522f75774bb3e861e6,RANGER-1868,Bug,Good coding practice in Ranger recommended by static code analysis,Ranger,Major
b3dc7bd42f4144be258265d22040cecef0bc2ee3,RANGER-1879,Bug,Yarn disable plugin script doesn&apos;t work,plugins,Major
502f3cea682013f5ca4ea5e702f887aabc60e538,RANGER-1875,Bug,The installer of the kms should not repeatedly add a user to the same group.,kms,Minor
44691b556dfe427d0c873c4f6537f55fa207a28c,RANGER-1830,Sub-task,Write unit test for RANGER-1810,plugins,Minor
 ,RANGER-1810,New Feature,Ranger supports plugin to enable  monitor and manage apache Sqoop2,plugins,Major
54c87fec53986dbe6e798aeab8e2a1d628c280b3,RANGER-1876,Bug,Incorrect conf dir location for Yarn install script,plugins,Major
29d9322ec4a0e12650d4be1e569a945ddde9dfcd,RANGER-1874,Improvement,ranger README.txt should be add tar and sqoop-plugin desc,Ranger,Minor
550cefcb6c7cd9009c123f8052cf6cc45ee6350b,RANGER-1870,Bug,Modify the logic for buildUnixUserList and parseMembers  method in UnixUserGroupBuilder class ,usersync,Minor
a62060fb08ab515c6251372098930dcfcd9bbdba,RANGER-1860,Bug,Provide a new service interface prompt function framework to resolved the defect of the current service interface  increase the flexibility of the function  improve user ease of use,admin,Major
45f40277c996ea754eb7efb995e73efaec311394,RANGER-1863,Bug,Optimize the code and keep the code style consistent  remove the invalid code in the RemoteUnixLoginModule class,usersync,Minor
4c1e80e6bb4262a4e11dbf5dfe9b9aad00fabc14,RANGER-1862,Bug,generalName.get(1)  cause IndexOutOfBoundsException in NiFiClient,plugins,Minor
a7163cb91dbf459c4e88025415ebab82a4a10f8b,RANGER-1864,Bug,Resources are not rendering correctly in policy create/edit page.,Ranger,Major
adffc001f44a38965860ce3e720d708ed13f8747,RANGER-1833,Bug,Update Ranger to use 0.8.1 Atlas version,Ranger,Major
8dc5598c034017a22bacf9e6082aa1f4a7d6cc23,RANGER-1858,Bug,ranger-admin start fail when policymgr_http_enabled equal to false.,admin,Critical
c1b9b90d1ba28b49791dac5877ef8ed643e3fc7b,RANGER-1859,Bug,Fix new findBugs in HdfsClient.java,admin,Major
454be055e496921c7384ada2cb1d00120c83bc48,RANGER-1856,Bug,Installation and access logic are inconsistent for the pid of kms program. Like security admin  they should be consistent.,kms,Major
e16fd4c338fc318c26721107107b12f414df79a3,RANGER-1857,Bug,The value of RANGER_KMS_HOME logic is not correct in dba_script.py and db_setup.py  Like db_setup.py in admin  we should optimize them.,kms,Minor
543b9ff006da4f64b951e2f6c0a6b16d9b703f22,RANGER-1846,Bug,This JAVA_VERSION_REQUIRED configuration item is invalid in security admin installer  we should enable it to control the necessary java version.,admin,Major
7fc74fccc9ab4e1b1f9a369b92e762afe241fcb3,RANGER-1781,Bug,RangerUI :Policy create/edit form should display only relevant accesses based on the user-selected resource.,Ranger,Major
79e91fa5f5175b3ddeab8d901f7e98697c9d639f,RANGER-1844,New Feature,Ranger admin support hdfs HA configuration when creating hdfs service.,Ranger,Major
ba99369a82914101d0652d68056a0b48eb69eea1,RANGER-1828,Bug,Good coding practice-add additional headers in ranger,Ranger,Major
847e121f5e210638d292eee0cb9beef34a037927,RANGER-1781,Bug,RangerUI :Policy create/edit form should display only relevant accesses based on the user-selected resource.,Ranger,Major
a4e69aab29a7c2362af26c0c46f8ed63d983370a,RANGER-1853,Bug,Masking functions based on custom masking of string types fails to unescape quotes properly.,Ranger,Major
8d9bd5fbaeb5a555134de50d3bab3ec560267c6f,RANGER-1846,Bug,This JAVA_VERSION_REQUIRED configuration item is invalid in security admin installer  we should enable it to control the necessary java version.,admin,Major
caf373daf8cce06c2fad7f6452756708e178cd38,RANGER-1845,Improvement,Add support to configure JWT signature algorithms,admin,Minor
9e8bfb9c28cc8eee2972e62dd256e8aa9d933c1e,RANGER-1842,Test,Don&apos;t catch Throwables in the test code,plugins,Trivial
33bf690cc7d09aacd10fa9f12ba073e5e6e1e124,RANGER-1843,Bug,Tag enricher performance improvement in identifying tags for resource being accessed,plugins,Major
97280ee10f8cb1c624e348227fc696adffa731ce,RANGER-1820,Bug,Duplicate entries should be deleted before creation of unique index on x_group and x_group_users table,Ranger,Major
c61f97a3d22c12c7817b0c441a2ba78b5465b3ee,RANGER-1839,Improvement,Add the ability to specify SSO token audiences,admin,Minor
c3fbdae9faf4e53816e9cc7b965f8a5aa59cf1e6,RANGER-1841,Bug,Audit log record for &apos;use dbName&apos; hive command contains large number of tags,plugins,Major
a2e896da0989c90060e767338165b3ccf27f6c67,RANGER-1795,Bug,Service should not be renamed if tagged service resources exist for it,admin,Major
6014e64a0fcfe957f4a0ee7e52cc29139b63ac92,RANGER-1838,Bug,Refactor Jisql dependencies,Ranger,Major
a98dc785a61ee9bbb1cdb4f8caac5a87dd163ed1,RANGER-1832,Bug,Export REST API should return exact matching results if polResource param is provided,Ranger,Major
8d39dfe99051968055f0f46a9275f59a276fc84a,RANGER-1835,Bug,The installer of the security admin should not repeatedly add a user to the same group.,admin,Minor
d9f54d72ca7eec9eeeb4f12f5ebfa71b61b2acc0,RANGER-1834,Bug,row filter policies are not returned by policy search,Ranger,Major
2cc88970bea34cdeac92182572a5046f09a70306,RANGER-1836,Bug,LOG class is imported error for RangerServiceService class,Ranger,Major
478f5ffc737b4c238db67e844e88fd73c61dc5da,RANGER-1832,Bug,Export REST API should return exact matching results if polResource param is provided,Ranger,Major
ca9b5f51241a802b0d28152779fe22412dd2f774,RANGER-1176,Bug,Ranger admin does not allow to create / update a policy with only delegate admin permission,admin,Minor
eed9eb2b5cb19756cab3b9085f930634c7d9dcd5,RANGER-1822,Improvement,Remove ssoEnabled accessors in RangerSSOAuthenticationFilter,admin,Trivial
7985dd473acb024e8f3c56c12af6608b0cecc3b6,RANGER-1781,Bug,RangerUI :Policy create/edit form should display only relevant accesses based on the user-selected resource.,Ranger,Major
e0c1e355a94cdecdf60e6d9eb0c54ff6d3bd412d,RANGER-1826,Bug,Import of bulk policies is causing OOM and Apparent Deadlock,Ranger,Major
ea9d66a249a169e2de8f90e0452a684c2629e762,RANGER-1815,Bug,Fix invalid code and error logic for the BaseDao class,audit,Minor
a341fa1af3e36c4809d5d834cafb6a3a8168ff4d,RANGER-1813,Bug,The drop-down box name &quot;database&quot; is not showing full when edit hive policy,admin,Minor
de417e1851603e98c2acb0e6a81b0f2524256a06,RANGER-1816,Bug,When the error occurs  the system does not record the error message,Ranger,Trivial
b383385fe32e1b7da32bc04ad1d47dd4907a3b38,RANGER-1750,Bug,In Nifi default policy is getting created with policyitem without any user/group but permission set for the same.,Ranger,Major
774f55845921c6a60ce5c06ccb19e339a5529d49,RANGER-1769,Bug,The update_property.py should exit the loop to improve execution efficiency once the attribute value is set.,admin,Minor
991481b2795de80c771d7354594b7c59ac5022ce,RANGER-1771,Bug,Improve performance of merging lists of policyEvaluators returned by Trie,Ranger,Major
d0cf2dd5545152701355560d2b2dbba19eec0b3b,RANGER-1752,Bug,When &quot;dfs.nameservices&quot; configures multiple nameservice id and then test hdfs connection  verifying &quot;dfs.client.failover.proxy.provider.[dfs.nameservices]&quot; is incorrect,plugins,Minor
f4019d11ba20fb6d61171876e4f14ea428028887,RANGER-1735,New Feature,Support representing nested group memberships in Ranger Admin,usersync,Major
6890976ee99a2f05fbec214003c67da7b2eb466d,RANGER-1766,New Feature,Execute &quot;grant all&quot; command failure in beeline mode when user used Ranger hive plugin,Ranger,Critical
c24c9bdfd2bc813febf16736877b7f43cd8bfeb5,RANGER-1763,Bug,The logic of the expansion button in the Edit Policy page is error. The user must click twice to collapse Conditions.,admin,Minor
513477d06d3dc2d4ac38eedfca83f58b6b8f28a7,RANGER-1739,Bug,build_ranger_using_docker script cannot download jdk8,Ranger,Trivial
5a736c2aaab7a7498dd143ce5078ba4e605536d9,/,/,    Clarifying readme,/,/
4075c08b9fd1c6ce6ef4fa2d3a1033e95d9d3d8a,/,/,    Fixing formatting of two other pages,/,/
a8fea7b6d2d40dc13a8aa4e92852fedc2dde5b40,RANGER-1157,Task,Handle the review suggestions from Josh Elser - during IPMC vote for ranger-0.6.1 (incubating) release ,documentation,Major
792e40bcdf6b209ed47f0508bd11efc820b0a5b8,RANGER-1754,Bug,group deletion message is wrong   it give User deleted successfully instead of group,admin,Major
95615f8eb7c6acd7c92c75527e8255d59143f68e,RANGER-1631,Bug,create temp function failing with permission issues,Ranger,Major
a71dab7fdf43cb939221c9aaa0e34a34df153dd6,RANGER-1755,Bug,hbase system tablename is old version in ranger-hbase-plugin ,plugins,Major
c7d1e50b231e10efb543b5ebec578598396b9f68,RANGER-1728,Improvement,Upgrade PMD plugin and fix related issues,build-infra,Trivial
e474c4d7b844c2cb3ac5609b68f56eee43ae4b64,RANGER-1753,Bug,Fix error message spelling mistake in XKeyREST.java,kms,Trivial
83b67df99b87e8fa14564e237623f8749f1fab81,RANGER-1751,Bug,The importJCEKSKeys.sh and DBMK2HSM.sh will throw an exception when the JAVA_HOME is equal to null.,kms,Minor
4daf1e9ed9f89f389f8cdb74baa1792f92fc2466,RANGER-1746,Bug,The prompt message is incorrect when test hdfs connection and check &apos;dfs.ha.namenodes.[nameservice ID]&apos; to be mandatory.,plugins,Minor
a43dd80f08857b99464934de9f5262851ab6749f,RANGER-1725,Bug,It is incorrect to judge whether you need to create a RangerServiceDef object for a given service,Ranger,Major
18a47ed4b8ea910a2c93c8707a0128f9b2af6ce5,RANGER-1726,Bug,Users are not getting deleted when Knox proxy is Enabled.,Ranger,Major
053cdd7b7e367aef09ab9d6b862f86fad35de811,RANGER-1748,Bug,User is unable to update existing policy while importing policy from file,Ranger,Major
b9cdb0bd540f4e092720026ca92ce934cc13f90d,RANGER-1717,Bug,User with &quot;KEYADMIN&quot; role is not able to see &quot;Audit =&gt; Admin&quot; logs.,Ranger,Critical
5fc9ee1f9a41d2dd73dad1dc9e32fbfaa38872a6,RANGER-1744,Bug,Similar to RANGER-1541  the assignment logic is inconsistent for the value of the RANGER_ADMIN_HOME variable in changeusernameutil.py and changepasswordutil.py. It will cause a serious failure.,admin,Major
 ,RANGER-1541,Bug,The assignment logic is inconsistent for the value of the RANGER_ADMIN_HOME variable in Ranger Admin. It will cause a serious failure.,admin,Major
5318e2f5f5610c3765df7971a48d5f3692e3286b,RANGER-1747,Bug,Usersync: LDAP Paged results seems to be ignored in Ranger ,usersync,Major
e0a010f5c859a52be452f92244c67ac045bdfbdf,RANGER-1736,Bug,Good coding practice in Ranger recommended by static code analysis,Ranger,Major
02c094393f40b209800f740a1ca8eaa8f7f4e43a,RANGER-1705,Bug,Good coding practice in Ranger recommended by static code analysis,Ranger,Major
a16889fbbd189ea6282030b528f8d17fac79144a,RANGER-1742,Bug,Like setup.sh  the set_globals.sh should check whether the user group exists before created user group in security admin.,admin,Minor
b676cd920cc64e6e8d286f231a714a65f93031ef,RANGER-1743,Bug,Comment lines have not been filtered out when the populate_global_dict function parsed install.properties in security-admin/scripts/restrict_permissions.py. Like RANGER-1284  we should modify it.,admin,Major
 ,RANGER-1284,Bug,Comment lines have not been filtered out when the populate_global_dict function parsed install.properties in security-admin/scripts/db_setup.py. ,admin,Major
a9523814cf4b3763a3a8db7d7eb3161e624074c5,RANGER-1741,Bug,The initd ran repeatedly when ranger-usersync-services.sh was running,usersync,Major
32999cd07c4dae454e0dde8fc3433c0e822d068d,RANGER-1740,Bug,There is a exception when the ranger_credential_helper.py was executed.,plugins,Major
ca9f7c1824f3d6bd0e2796b9aed4ec5f66bb3baa,RANGER-1632,Bug,Users are not sync&apos;d when sAMAccountName is different than CN associated with groups,usersync,Major
d4cf1226427e8c49e63a751f4fe8bada565f64d1,RANGER-1676,Bug,Policy Details popup from Access audit page not displaying details of masking policy,Ranger,Major
f6d4f116c5ecf0a656b1cba3846cfd3cbd9e5393,RANGER-1724,Bug,On Report listing page for masking/row filter policies show only mask/row filter conditions,Ranger,Major
c8058ad8056c534688551b2e1767611d47d66ab7,RANGER-1674,Bug,IMPORT START audit is not appearing on audit page,Ranger,Major
1b4e78b0dcfad74b7fd2baea16364b7daf32159e,RANGER-1737,Bug,Fix potential performance issue introduced by RANGER-1181 ,plugins,Major
 ,RANGER-1181,Bug,HDFS Plugin does not allow removal of a non-empty directory if the directory is allowed to be removed by HDFS  but the file inside the directory is allowed to be removed by Ranger,plugins,Major
f7230f70a4de21c7bac9028a05f9f7472077e809,RANGER-1734,Bug,Close the connection in the HIVERangerAuthorizerTest,plugins,Trivial
3dc21364c4b50444147aa45bc9bcc4c1325f8f2d,/,/,    Remove duplicate RangerDaoManager fields,/,/
71023632235ec0ad1e85962f47153c586983b225,/,/,    Exclude old guava versions  which could cause build problems  especially with owasp-java-html-sanitizer  which declares the deps as a range: [11.0 ) Guava is already included in the admin module,/,/
9f5721bbed8057586e63a5ea5552ddecf5cc67ca,RANGER-1491,Wish,Automatically map group of external users to Administrator Role,Ranger,Major
0878d19e9fc39c13c136411ee4df6c6fa33c7b43,RANGER-1669,New Feature,We need to support the original functionality of hive&#65306;show grant user username,plugins,Critical
0736d98e23441a112567b470254cc47bbdf2cb69,RANGER-1725,Bug,It is incorrect to judge whether you need to create a RangerServiceDef object for a given service,Ranger,Major
4ce27cffb96e21e2e7ece628b0a303c52746204d,RANGER-1649,Bug,Ranger Solr Plugin fails to refresh policy due to failure in ticket renewal mechanism,Ranger,Major
688807cf74fc434e246a2f7d6c0e71e941178421,/,/,    Refactoring duplicate code for exception wrapping in BaseClient,/,/
f01bcf3d003500eaa28c1f48b8eac83fb037298a,RANGER-1723,Bug,The Ranger doesn&apos;t support solr6. In the HttpSolrClient class of solr6  the setMaxRetries function has been removed  which causes ranger to fail to compile.,Ranger,Major
c5daf83bc225a6249022e23fd0cbcadeb56a0987,RANGER-1708,Bug,Remove tag services from service type and service name filters under Access Audit.,Ranger,Major
93c900c346cdac33e268c2e76e2f37568cc1c7f3,/,/,    Remove deprecated and unused code from the HBase plugin,/,/
1befffcc1c18679cdf2c6413496b2078f6d2a838,RANGER-1501,Bug,Audit Flush to HDFS does not actually cause the audit logs to be flushed to HDFS ,audit,Major
c12cfd97728b1209fa5340a42b9528d008f10db5,RANGER-1501,Bug,Audit Flush to HDFS does not actually cause the audit logs to be flushed to HDFS ,audit,Major
b6c631dbdba2329b760eedeb58c983555648f504,RANGER-1502,Bug,Solr shutdown does not cause the audit log file to be flushed and closed.,plugins,Major
13620b2647899732452ad883a33cd4e98fe70edb,RANGER-1713,Bug,Hive testConnection failed after used ldap authentication in Hive.,plugins,Major
7c401b3e305c3ec7de47105a2980a9152ae04ce4,RANGER-1714,Bug,Disable dynamic sorting of policies when trie pre-filter is enabled,plugins,Major
7d5d00c15d4fdde8d57182dc67ec05b883474191,RANGER-1690,Bug,Ranger usersync created error users. Ranger usersync got System Virtual User Group Name instead of real group name when built the unix user list. ,usersync,Major
a89ddecf05b9b22c6b5faf2f2f7acd12cbb1f7ca,RANGER-1706,Improvement,Running CI on Travis,Ranger,Major
edd0bd6a69b4919745d79119e943ad4b330941d0,/,/,    RANGER:1669:We need to support the original functionality of hive.show grant user username,/,/
1685bacf057b773210ae8ca055a6668ea2fa7dd5,RANGER-1709,Bug,kms test case write logs to log file,kms,Minor
96b0c48602d777e7f1aacc6b7253fed874811b1a,RANGER-1695,Bug,Optimize Ranger code for authorization of HDFS &apos;getContentSummary&apos; and &apos;delete&apos; commands,Ranger,Major
88352408b535d82bbef1b1ffc79b16fb57ffb505,RANGER-1698,Bug,Write audit log to solr failure.,kms,Critical
5055db1535098f25603cb63fa4bb5aa521d6161a,RANGER-1696,Bug,Request to get all policies for hive or hbase service-type does not include policies that apply to specific child resource(such as table in hive/column family in hbase),Ranger,Major
55e6d4e1398f27d897795a174a332d6e18642b08,RANGER-1638,Bug,Improve the password validation from Ranger API,admin,Major
66e1ce2e1eb2bcf894178be5a6b64f60dc8faeed,RANGER-1690,Bug,Ranger usersync created error users. Ranger usersync got System Virtual User Group Name instead of real group name when built the unix user list. ,usersync,Major
c5332d123411535f3dbfeef7b1872d97cc087bb2,RANGER-1693,Bug,The pidf&apos;s assignment logic in ranger-kms-initd should be consistent with the pidf&apos;s assignment logic in ranger-kms,kms,Major
15fd7fa5d1a734246640e1337d2b2b927dccc486,RANGER-1692,New Feature,Similar to RANGER-1540  the Ranger kms should also support the same new feature.,kms,Minor
 ,RANGER-1540,New Feature,Log is very important for big data platform. The main purpose of log analysis is that we need to know who is running the service  in which machine running service  which service out of the problem. The ranger security admin should support the feature.,admin,Major
