b5971264f29c6646bc543b47c58786f6322f0bd0,/,/,    auto rebalance last commit,/,/
a2745382de26d30cfcbad11abc398150e720540f,/,/,    kafka-1271; controller logs exceptions during ZK session expiration; patched by Jun Rao; reviewed by Guozhang Wang and Jay kreps,/,/
fbb3525ce8f2656869959bce0f32392577d776a0,KAFKA-1254,Sub-task,remove vestigial sbt,None,Major
11f3975930a72823b20532c8c37732e47f4a2f6b,KAFKA-1274,Sub-task,gradle.properties needs the variables used in the build.gradle,None,Blocker
cb23e5d915ce14ca25d74abb55b329b83054500b,KAFKA-1245,Sub-task,the jar files and pom are not being signed so nexus is failing to publish them,None,Blocker
879e3e770ebc49f916137e8416df74373fa26a74,KAFKA-1263,Bug,Snazzy up the README markdown for better visibility on github,None,Major
5023c2ff2e7293cd559513d3fed811b08048198d,/,/,    kafka-1244 kafka-1246 kafka-1249; various gradle issues for release; patched by Jun Rao; reviewed by Neha Narkhede,/,/
8d623e157d23af345857b5e69af5f3577c49ebad,KAFKA-1158,Improvement,remove bin/run-rat.sh,None,Major
cef51736c70f591baf4b384444e2f0d28a906d5e,KAFKA-330,New Feature,Add delete topic support ,replication,Blocker
36eae8f63c81f8d38c2351054c15bf7d5eb612d9,/,/,    trivial fix to add missing license header using .gradlew licenseFormatMain and ./gradlew licenseFormatTest; patched by Jun Rao,/,/
52614ad65e698a9860ab22b2ce66bae773263b36,/,/,    kafka-1171; Gradle build for Kafka; patched by David Arthur  Joe Stein  Chris Freeman and Jun Rao; reviewed by Guozhang Wang  Joel Koshy and Neha Narkhede,/,/
8c9a7811c492d23b706ff2c3a728d8c49a387885,/,/,    Minor fix for delete topic,/,/
1032bf74054a198d5d663713be1152a9216ca150,/,/,    kafka-1232; make TopicCommand more consistent; patched by Jun Rao; reviewed by Guozhang Wang and Neha Narkhede,/,/
167acb832d7f104eb2c344dcfd7b914c763d881d,KAFKA-330,New Feature,Add delete topic support ,replication,Blocker
fa6339c19cd06880d32ec9a5ee6b66e7f1488dcf,/,/,    Rename client package from kafka.* to org.apache.kafka.*,/,/
3220af1fe2fad8da1f5bcc101ab9d3e8919b03bd,/,/,    TRIVIAL: Fix misc. numerical issues in histogram.,/,/
253f86e31062fb86401abdc13835c251eef47417,/,/,    Implement a few of the API suggestions from the mailing list.,/,/
c9052c5ff510f4b750d456b7efa159b39501da98,/,/,    trivial typo fix; patched by Moritz Schw?rer; reviewed by Jun Rao,/,/
74b42a8f810281e26d80d764fc8f391836b87844,KAFKA-1164,Bug,kafka should depend on snappy 1.0.5 (instead of 1.0.4.1),None,Major
2b0c6a7d7b83a58362e32191674e55da25d3077f,/,/,    kafka-1228; Socket Leak on ReplicaFetcherThread; patched by Ahmy Yulrizka; reviewed by Jun Rao,/,/
9c1d8e35c5913d22098cf80ae69035131cfee87f,KAFKA-1184,Task,High-Level Consumer: expose fetcher threads number as a parameter,consumer,Major
269d16d3c915d09f650ae32aa81542bd8522ca68,KAFKA-1227,New Feature,Code dump of new producer,None,Major
26a02c32dda0222c6ab1ad897992558c1c1eab76,KAFKA-1055,Bug,BrokerTopicStats is updated before checking for MessageSizeTooLarge,None,Major
c9028ad8c5d8bac9278836ebbc21fada5e6b562b,/,/,    kafka-1214; Support arguments to zookeeper-shell.sh script; patched by Philp K. Warren; reviewed by Jun Rao,/,/
e1f7bea157c828d1eefdc5f9cf0337be79d809eb,/,/,    kafka-1205; README in examples not update; patched by Ailing Zhang; reviewed by Jun Rao,/,/
c2ed6415fcfa02d08dde031f0f799f5a0f18d8c5,/,/,    kafka-1208; Update system test still to use kafka-topics instead of kafka-create-topics shell; patched by Guozhang Wang; reviewed by Jun Rao,/,/
855340a2e65ffbb79520c49d0b9a231b94acd538,/,/,    kafka-1202; optimize ZK access in KafkaController; also incorporating fixes in kafka-1020; patched by Jun Rao and Guozhang Wang; reviewed by Neha Narkhede and Joel Koshy,/,/
d401292abb0f3660895173d4613f712058ae097f,KAFKA-1200,Bug,inconsistent log levels when consumed offset is reset,consumer,Major
d2e2c607d1490cf2121dd64f4e79f34ba64c8ed7,KAFKA-1199,Improvement,Add a reduced access log level,network,Major
f63e3f730673f60ca179030cf0d64380689c2a40,/,/,    kafka-1074; Reassign partitions should delete the old replicas from disk; patched by Jun Rao; reviewed by Jay Kreps  Neha Narkhede and Guozhang Wang,/,/
15f3c8417e07e6bc6cbe0c5991f5641396c61b24,/,/,    kafka-1198; NullPointerException in describe topic; patched by Guozhang Wang; reviewed by Jun Rao,/,/
3f88be6318670864b372deccb2af705e8c84382a,KAFKA-1187,Bug,Controller should retry connecting to brokers to send state change requests,controller,Critical
a119f532c8b310122d85391efe11fd26027ef7f9,KAFKA-1185,Improvement,Improve leader elector module to have a resign API,core,Major
 ,KAFKA-930,Bug,Integrate preferred replica election logic into kafka,None,Major
10fa20001dd22a2cfc7da065d75d7cf6c0009b42,KAFKA-1185,Improvement,Improve leader elector module to have a resign API,core,Major
b23cf1968f2aa4f8dbd6629634ae813b5e14564c,KAFKA-930,Bug,Integrate preferred replica election logic into kafka,None,Major
b5d16871c02a585643aec3229546af04721bb42c,KAFKA-1139,Bug,Topic data change handling callback should not call syncedRebalance directly,None,Major
dd58d753ce3ffb41776a6fa6322cb822f2222500,KAFKA-1134,Bug,onControllerFailover function should be synchronized with other functions,None,Major
169a79e687799bffd5cf1f4bb86855bf3725cb88,KAFKA-1142,Bug,Patch review tool should take diff with origin from last divergent point,None,Major
6bc290f66d738a9133afe93e2a6ac64f1344c111,KAFKA-1178,Bug,Replica fetcher thread dies while becoming follower,replication,Critical
32aae7202ce041128fb1f6d2ea43580ee7864d74,KAFKA-1170,Bug,ISR can be inconsistent during partition reassignment for low throughput partitions,controller,Critical
876cfdb59730f0e0c0f87aed15d65fa747c19bd3,KAFKA-1167,Improvement,Improve the kafka-topics tool to list the topics with overridden configs,tools,Major
7dee06ee99bf2610d71df04e4e5238a10a8388a2,/,/,    kafka-1169; missing synchronization in access to leaderCache in KafkaApis; patched by Jun Rao; reviewed by Neha Narkhede,/,/
8a2ba3f6f2eab88db4b5ea6d880ec2feba93276c,/,/,    kafka-1168; OfflinePartitionCount in JMX can be incorrect during controlled shutdown; patched by Jun Rao; reviewed by Swapnil Ghike,/,/
6c36beef873e8696e3e68b38c886893e01ce6dbb,KAFKA-1152,Bug,ReplicaManager&apos;s handling of the leaderAndIsrRequest should gracefully handle leader == -1,None,Major
ea3961fc84c5a45a5458b9db4080b32f28855f7b,KAFKA-1156,Bug,Improve reassignment tool to output the existing assignment to facilitate rollbacks,tools,Critical
b638b0f34623769e2efbcb7c2c36f7b742f6b690,/,/,    kafka-1157; Clean up Per-topic Configuration from Kafka properties; patched by Guozhang Wang; reviewed by Jun Rao,/,/
7c7951426df5fe8a65b176fe49584868e7af3b4f,/,/,    kafka-1154; replicas may not have consistent data after becoming follower; patched by Jun Rao; reviewed by Guozhang Wang and Neha Narkhede,/,/
224f192c776b4348596fbf068771c98aa9db9f3d,/,/,    kafka-1152; ReplicaManager's handling of the leaderAndIsrRequest should gracefully handle leader == -1; patched by Swapnil Ghike; reviewed by Jun Rao,/,/
df288b75a0c6685deeda99ce4db3e17fff39b0ad,/,/,    kafka-1140; Move the decoding logic from ConsumerIterator.makeNext to next; patched by Guozhang Wang; reviewed by Jun Rao,/,/
ac239da502c4de10f63b0b5d638c3d8b11711eae,/,/,    Update description of num.partitions config in sample server properties - issue reported by Vaibhav Puranik,/,/
583044cd5109cd060bdfc9e516f4c85d1d4e73a0,/,/,    recommit kafka-1112 since it's inadvently reverted in the commit of kafka-1135,/,/
bb2dc49bde2f77b7ceb9e47a0f710204530774a4,KAFKA-1133,Bug,LICENSE and NOTICE files need to get into  META-INF when jars are built before they&apos;re signed for publishing to maven,None,Major
87efda7f818218e0868be7032c73c994d75931fd,/,/,    kafka-1103; Consumer uses two zkclients; patched by Guozhang Wang; reviewed by Joel Koshy and Jun Rao,/,/
2477a7468e7bfe728abae793236d8aaf1c211d3b,/,/,    kafka-1136; Add subAppend in Log4jAppender for generic usage; patched by Jie Huang; reviewed by Joel Koshy and Jun Rao,/,/
99dd94c9b659775e738e12330d90ae7ebe7bdbb6,/,/,    kafka-933; Hadoop example running DataGenerator causes kafka.message.Message cannot be cast to [B exception; patched by drunkedcat; reviewed by Jun Rao,/,/
cd81d37ac872654c0cc68fab830ee457c56b7c6a,/,/,    fix for scala 2.10.1 compilation issued introduced in kafka-1117,/,/
c2dd071b52632c638fefcf864cc2aa1a2cac629b,KAFKA-1131,Improvement,copy some more files into the release tar and zip that are needed/desired,None,Major
9b0776d157afd9eacddb84a99f2420fa9c0d505b,/,/,    kafka-1135; Code cleanup - use Json.encode() to write json data to zk; patched by Swapnil Ghike; reviewed by Neha Narkhede  Guozhang Wang and Jun Rao,/,/
440e45e5131131a30987b991eabfee147061c42b,/,/,    kafka-1117; tool for checking the consistency among replicas; patched by Jun Rao; reviewed by Neha Narkhede  Joel Koshy  Swapnil Ghike  Guozhang Wang,/,/
58789d7cbe21f0b29f4a94a1fe75d1f1e0851d86,/,/,    kafka-1127; kafka and zookeeper server should start in daemon mode and log to correct position; patched by Raymond Liu; reviewed by Jun Rao,/,/
7c54e39bd48c9908c220ee68cee608a0d0cf5d9d,KAFKA-1112,Bug,broker can not start itself after kafka is killed with -9,log,Critical
eedbea6526986783257ad0e025c451a8ee3d9095,KAFKA-1119,Bug,Kafka 0.8.1 overwrites previous per topic config changes,config,Critical
a700c99efddb3ae83b42a2bcf5c58dd16ee7edf1,KAFKA-1126,Bug,Remove the DISCLAIMER it is left over from incubation,None,Major
98616188645d1d57e98a6b92f615345fc7653d9d,KAFKA-1121,Bug,DumpLogSegments tool should print absolute file name to report inconsistencies,None,Major
7d1ac1d806ea893a1503c35dbd6087941dc5c25c,/,/,    Minor logging improvement,/,/
df7f7a255bdd803cddfdf3fea2ace4f1ae366377,KAFKA-1097,Bug,Race condition while reassigning low throughput partition leads to incorrect ISR information in zookeeper ,controller,Critical
e602ed0582b04d7b6fd442990dd3182f1e2834a5,KAFKA-1113,Bug,log.cleanup.interval.mins property should be renamed,config,Major
a4fafefdb3a2701d30f14feed3be11f1c0905c31,KAFKA-1107,Bug,Broker unnecessarily recovers all logs when upgrading from 0.8 to 0.8.1,log,Blocker
ec547737de730cddb29200eba62c0165f901447b,KAFKA-1107,Bug,Broker unnecessarily recovers all logs when upgrading from 0.8 to 0.8.1,log,Blocker
a55ec0620f6ce805fafe2e1d4035ec3e0ab4e0d0,/,/,    kafka-1092; Add server config parameter to separate bind address and ZK hostname; patched by Roger Hoover; reviewed by Jun Rao,/,/
bf4dbd5ee3be67a214c01aae0bf01b1492994cf5,KAFKA-1060,Bug,Break-down sendTime into responseQueueTime and the real sendTime,None,Major
bd49e4f3e77c86a9cd93262e628143fff762d4ee,KAFKA-1001,Improvement,Handle follower transition in batch,None,Major
274b12f3351e007f76e8ef64ba9baf5b0824e690,/,/,    kafka-918; Change log.retention.hours to be log.retention.mins; patched by Alin Vasile; reviewed by Jun Rao,/,/
0e90c246c68954204ea524139023d97173bfde56,KAFKA-1098,Bug,Unit test failure in 0.8.1 related to LogCleaner,log,Major
0198e67febfa805b7a5d7ef8a939254bbe0b0d00,KAFKA-1042,Improvement,Fix segment flush logic,log,Critical
b61d147fd0774370a41d2a6cadcbfd30c7703a34,KAFKA-1094,Bug,Configure reviewboard url in kafka-patch-review tool,None,Major
d030778861e6d274281adf7e0311dc4d51448c84,KAFKA-1042,Improvement,Fix segment flush logic,log,Critical
d0e948ca86730a900adbe3300fe4af01cf15922a,/,/,    kafka-1090; testPipelinedRequestOrdering has transient failures; patched by Jun Rao; reviewed by Joel Koshy  Guozhang Wang  and Neha Narkhede,/,/
c66e4d58687bee54bae6a31e976d4b9b63c36de1,/,/,    kafka-1091; full topic list can be read from metadata cache in the broker instead of ZK; patched by Jun Rao; reviewed by Joel Koshy  Guozhang Wang  Swapnil Ghike  and Neha Narkhede,/,/
b448d4e075f0f138530e6cfc0634f4035c8d1878,KAFKA-1086,Improvement,Improve GetOffsetShell to find metadata automatically,None,Major
d5dfa28596857d5564c14b598901653714717bdc,KAFKA-1089,Bug,Migration tool system tests soft-fail on 0.8 and trunk,None,Major
ccdb56201e494d6025e47a48c82f233ccc9386ac,KAFKA-1036,Bug,Unable to rename replication offset checkpoint in windows,None,Critical
c98b6de15db9a2ce72f44a5b2736f74de5066113,KAFKA-1008,Bug,Unmap before resizing,log,Major
a160f1023b23c7d9d79c7970a72f48ae883dfe07,KAFKA-1086,Improvement,Improve GetOffsetShell to find metadata automatically,None,Major
e351039b1a9ed188e3be1581f31674b876094274,/,/,    kafka-1084; Validate properties for custom serializers; patched by Francois Saint-Jacquese; reviewed by Jun Rao,/,/
062d910e3235ef71b1e7a01472f4360658c83bea,KAFKA-1087,Bug,Empty topic list causes consumer to fetch metadata of all topics,None,Major
3e7c9c6abfed90b4e6e0e1bb3c806adf1c6bbbe9,KAFKA-1081,Bug,kafka-run-class.sh is broken,None,Major
b0fecacbe8232deea5ea8a71e8dd9b57c7cf0435,KAFKA-1018,Bug,tidy up the POM from what feedback has come from the 0.8 beta and publishing to maven,None,Major
ace95c48a924db69ea6c6053d4cc2943c7b8958a,/,/,    trivial change to remove unused command bin/kafka-add-partitions.sh,/,/
8d4dbe60f188c48a7f0d552b7b1109fb8e126521,/,/,    kafka-1052; integrate add-partitions command into topicCommand; patched by Sriram Subramanian; reviewed by Jun Rao,/,/
343a1e2660aa7c3c847c459360a5fbbcb065c759,/,/,    Merge remote-tracking branch 'origin/0.8' into trunk,/,/
b384c27c33dc12d466b4e432b03faea5f88b55aa,/,/,    kafka-954; tidy up README file for better general availability; patched by Jun Rao; reviewed by Joe Stein and Neha Narkhede,/,/
a6904a2644a95a3d8d2a59e3915a76e7ee43557a,/,/,    kafka-1078; Update System Test to handle controller data returned by ZK; patched by John Fung; reviewed by Jun Rao,/,/
f53fe18361a434c388e88b0eed90b8faa0983fd8,/,/,    kafka-1069; MBean kafka.cluster.Partition report wrong UnderReplicated status; patched by Jun Rao; reviewed by Neha Narkhede,/,/
bfc4ba499521addf3d109c3fbe77b8908eabc644,/,/,    Merge remote branch 'origin/0.8' into trunk,/,/
1cb217579bbb1f9d4df24a3d32bf88644697b7fe,KAFKA-1075,Bug,Consumer will not rebalance upon topic partition change,None,Major
40efe0a972e8a1673b51b05f3937265d97acb01c,/,/,    trivial follow-up patch for kafka-1073 to fix unit tests; patched by Jun Rao,/,/
71ed6ca3368ff38909f502565a4bf0f39e70fc6c,/,/,    kafka-1073; CheckReassignmentStatus is broken; patched by Jun Rao; reviewed by Guozhang Wang  Swapnil Ghike and Neha Narkhede,/,/
2c6d3c7b450e50e2efaab8d55a5574b2ec1cd376,/,/,    kafka-1076; system tests in 0.8 are broken due to wrong log4j config; patched by Joel Koshy; reviewed by Jay Kreps and Jun Rao,/,/
93921a3a5720a1ffd9e272d59d8a7627da28e89e,KAFKA-1071,Bug,The random partition selected in DefaultEventHandler is not random across producer instances,core,Major
dcbf0bf0b7e949e0f2652d6f3bd967349813bf6f,KAFKA-1068,Bug,OfflinePartitionCount metrics may be incorrect after the controller failover,None,Major
56ada9576204b754e792a3d3c9063908f4f24b4d,KAFKA-939,Bug,./sbt publish-local fails due to invalid javac flags passed to javadoc,None,Major
bb7b45cd5d454d64c3454b01f8f3f1e13ed26ff3,/,/,    kafka-946; Kafka Hadoop Consumer fails when verifying message checksum; patched by Sam Meder; reviewed by Jun Rao,/,/
61b8b2bf818c36e5844a32b24b2855c32bd34254,KAFKA-1062,Bug,Reading topic metadata from zookeeper leads to incompatible ordering of partition list,consumer,Major
8959690e96f22e6905f80c76faa355448e4d2e51,KAFKA-1053,New Feature,Kafka patch review tool,tools,Major
d6f95cf97a928067977fef5216e954d5147fd138,KAFKA-1053,New Feature,Kafka patch review tool,tools,Major
c6ca971738700643ecba78ad1f3998062481aab9,KAFKA-1030,Bug,Addition of partitions requires bouncing all the consumers of that topic,None,Blocker
9feef9fd60920cf25a88e03dc5711745c0b7c0c5,/,/,    Trivial commit: Fix whitespace in Utils.rm.,/,/
aebf746190685d055358ca122aedc424fe024afa,KAFKA-1038,Bug,fetch response should use empty messageset instead of null when handling errors,core,Major
0c1885b800077e4d360935a6d91fe1068a684560,KAFKA-955,Bug,After a leader change  messages sent with ack=0 are lost,None,Major
324936609f9e087aa4168e7f7581148e34b346a4,/,/,    merge from 0.8 c12d2ea9e5b4bdcf9aeb07c89c69553a9f270c82 to trunk,/,/
fed901cad2e7f8fe8dffd36b72006d912c18743a,KAFKA-1046,Improvement,Added support for Scala 2.10 builds while maintaining compatibility with 2.8.x,None,Major
8e554c4d2acf5108805905b9f06198f20398ee3a,KAFKA-1046,Improvement,Added support for Scala 2.10 builds while maintaining compatibility with 2.8.x,None,Major
75d95d9b0770d187916bed1dd1ca7a3e82ef08b0,/,/,    merge from 0.8 da4512174b6f7c395ffe053a86d2c6bb19d2538a and resolve conflicts,/,/
c12d2ea9e5b4bdcf9aeb07c89c69553a9f270c82,KAFKA-1046,Improvement,Added support for Scala 2.10 builds while maintaining compatibility with 2.8.x,None,Major
da4512174b6f7c395ffe053a86d2c6bb19d2538a,/,/,    kafka-1035; Add message-send-max-retries and retry-backoff-ms options to console producer; patched by Rajasekar Elango; reviewed by Guaozhang Wang and Jun Rao,/,/
20953b52558935ba210eaee18e9504bf16bfec27,/,/,    kafka-937; delta patch; ConsumerFetcherThread can deadlock; patched by Jun Rao; reviewed by Joel Koshy,/,/
f89ddced1ba058f0c51697957cde8bb2e2b05c4d,KAFKA-955,Bug,After a leader change  messages sent with ack=0 are lost,None,Major
ea54700d57e18e59e210814b70bddca38739d414,/,/,    Merge branch '0.8' of http://git-wip-us.apache.org/repos/asf/kafka into 0.8,/,/
51de7c55d2b3107b79953f401fc8c9530bd0eea0,/,/,    kafka-1031; Little modification to the stop script to be able to kill the proper process; patched by Vladislav Pernin; reviewed by Jun Rao,/,/
39fc578d5da3f871fbcd5205de010f1f574507d1,KAFKA-990,Bug,Fix ReassignPartitionCommand and improve usability,None,Major
7640bee3d281e0658f97997738a1f1f599fd4c07,KAFKA-1029,Bug,Zookeeper leader election stuck in ephemeral node retry loop,controller,Blocker
d217f4cc276eee021a0d756d3390b633e43f7115,/,/,    kafka-1017; High number of open file handles in 0.8 producer; patched by Swapnil Ghike; reviewed by Neha Narkhede and Jun Rao,/,/
ff6292904a67cd021d365ef1e07c113002b80582,KAFKA-1009,Bug,DumpLogSegments tool should return error on non-existing files,log,Minor
ceb55cad5863fa7c39615e48a5d6358eb416a83e,/,/,    kafka-649; patch v5; Cleanup log4j logging; patched by Guozhang Wang; reviewed by Jun Rao,/,/
6849da0505da1f38edfbfb64e27cff504231142a,/,/,    kafka-992; follow-up patch; Double Check on Broker Registration to Avoid False NodeExist Exception; patched by Guozhang Wang; reviewed by Neha Narkhede and Jun Rao,/,/
7a9faa49ed5c7581cb2bd6c86b68df06a8879fec,/,/,    kafka-1010; Concurrency issue in getCluster() causes rebalance failure and dead consumer; patched by Sam Meder; reviewed by Jun Rao,/,/
1db824ed2fcdaa45c3b1d0dcbf9101299fded09c,KAFKA-992,Bug,Double Check on Broker Registration to Avoid False NodeExist Exception,None,Major
1d75e09313b5b3f1cde6c39fdda20bc7185cfdf6,KAFKA-992,Bug,Double Check on Broker Registration to Avoid False NodeExist Exception,None,Major
81c49bbdae5e490f9d5dc7b042ee60e617fbb22b,KAFKA-992,Bug,Double Check on Broker Registration to Avoid False NodeExist Exception,None,Major
e7a546b67cdcdcbb1071ed805a4e4177cbbc15ff,/,/,    kafka-1003; ConsumerFetcherManager should pass clientId as metricsPrefix to AbstractFetcherManager; patched by Swapnil Ghike; reviewed by Jun Rao,/,/
9753d15ef1da0ecab9bbee51d8cdc08c2159c50b,KAFKA-999,Bug,Controlled shutdown never succeeds until the broker is killed,controller,Critical
df18fe13ad50bba3dbc7d1db0ecd8b698169ade2,KAFKA-615,New Feature,Avoid fsync on log segment roll,None,Major
1d6ad3d7d441bc7174a445a4e5e49319ee1003eb,/,/,    kafka-989; Race condition shutting down high-level consumer results in spinning background thread; patched by Phil Hargett; reviewed by Jun Rao,/,/
7fbbb6666bef10f31301c4af17a6077e8895fa06,KAFKA-992,Bug,Double Check on Broker Registration to Avoid False NodeExist Exception,None,Major
14af713252f016929f8150f2f6c2df9d0d447ddb,/,/,    Misc. minor house-keeping fixes: add reasonable GC settings  fix up README  fix up example configs  fix the logging for tools  use a log directory for logs instead of the root directory.,/,/
f3f8fa5c8c17ade2205ef0f80d9092cae640327d,KAFKA-992,Bug,Double Check on Broker Registration to Avoid False NodeExist Exception,None,Major
493a46613e9a90c0879de96d04c42696fdf95510,KAFKA-985,Bug,Increasing log retention quickly overflows scala Int,log,Minor
bdb2fdc6460c48189b487e1e8a75c344e32aa222,KAFKA-995,Improvement,Enforce that the value for replica.fetch.max.bytes is always &gt;= the value for message.max.bytes,config,Minor
81a9f6a682e5ca35a041717d6c1d4a60af5fd36a,KAFKA-915,Bug,System Test - Mirror Maker testcase_5001 failed,None,Critical
 ,KAFKA-956,Bug,High-level consumer fails to check topic metadata response for errors,consumer,Blocker
ed3e146cf4b48683756e3c445f539fa99ba9076a,/,/,    Merge branch '0.8' of http://git-wip-us.apache.org/repos/asf/kafka into 0.8,/,/
0c8aefc251d03ba824cecd6acbcbdf143fdebfb8,/,/,    kafka-994; High level consumer doesn't throw an exception when the message it is trying to fetch exceeds the configured fetch size; patched by Sam Meder; reviewed by Jay Kreps and Jun Rao,/,/
b6479e8adca6be8e363d289be29dc755e0655550,KAFKA-991,Bug,Reduce the queue size in hadoop producer,None,Major
8edd3e63024832f2c05b5819ab3dfc2e0b300729,KAFKA-991,Bug,Reduce the queue size in hadoop producer,None,Major
d285e263bf403f3db27f5d138594c395643a2284,KAFKA-925,New Feature,Add optional partition key override in producer,producer ,Major
76d39052f717cb6d9fdac6a516df298036b5ffff,/,/,    kafka-959; DefaultEventHandler can send more produce requests than necesary; patched by Guozhanh Wang; reviewed by Jun Rao,/,/
bc5620cbd270cd8ab443f567fee5203c66db253f,KAFKA-983,Bug,Expose cleanshutdown method in MirrorMaker at the object level,None,Major
5cf6a546649c213c33ef41d5d47e6af959c0c587,KAFKA-957,Bug,MirrorMaker needs to preserve the key in the source cluster,core,Major
401d59199cf727f5001dcec3eaa05fa9cdfd079e,KAFKA-987,Bug,Avoid checkpointing offsets in Kafka consumer that have not changed since the last commit,None,Major
ce7d588055e7d3aacebcc696665b1260fa2e9063,/,/,    kafka-883; System Test - update migration tool testsuite after 0.7 ProducerPerformance sends seq MessageID; patched by John Fung; reviewed by Jun Rao,/,/
f596ab577869a71811fee6bffdfcd171cd188fa6,/,/,    kafka-832; System Test - set retry.backoff.ms=300 to all test cases; patched by John Fung; reviewed by Jun Rao,/,/
d3aa3ef073fe773a10168f925a45747f52c4e3c0,/,/,    kafka-879; In system test  read the new leader from zookeeper instead of broker log on completion of become-leader state transition; patched by John Fung; reviewed by Jun Rao,/,/
3817857b15f9ce03f10a9730f0ff4619d728b06f,/,/,    kafka-347; change number of partitions of a topic online; patched by Sriram Subramanian; reviewed by Neha Narkehede  Guozhang Wang  Joel Koshy and Jun Rao,/,/
b1891e700889e8e4ae78a6d73d785ff681ac70b9,KAFKA-974,Bug,can&apos;t use public release maven repo because of failure of downloaded dependency,None,Major
c27c768463a5dc6be113f2e5b3e00bf8d9d9d602,KAFKA-852,Bug,Remove clientId from OffsetFetchResponse and OffsetCommitResponse,core,Minor
db37ed0054305a3f5d824166914092076b10ac1e,/,/,    kafka-965; merge c39d37e9dd97bf2462ffbd1a96c0b2cb05034bae from 0.8 to trunk; patched by Jun Rao; reviewed by Jay Kreps,/,/
bf31a6bf705f0438dfc15320ff7047a62eb8f94d,/,/,    kafka-969; Need to prevent failure of rebalance when there are no brokers available when consumer comes up; patched by Sriram Subramanian; reviewed by Joel Koshy and Jun Rao,/,/
2cda5d1fca90e93ecfd44665fe32033ddce99c52,/,/,    Merge branch 'trunk' of https://git-wip-us.apache.org/repos/asf/kafka into trunk,/,/
c98bdd3e4f6edb7a4db97a876c26e7d37e88e12a,/,/,    kafka-896; merge 0.8 (988d4d8e65a14390abd748318a64e281e4a37c19) to trunk; patched by Jun Rao; reviewed by Jay Kreps,/,/
c39d37e9dd97bf2462ffbd1a96c0b2cb05034bae,/,/,    kafka-964; Default hadoop-producer configs to request.required.acks = 1; Patched by Swapnil Ghike; reviewed by Jun Rao,/,/
6b53c649e9d5708d683431522ca750e2fde40fb9,KAFKA-963,Bug,when publishing to maven repository central missing signature on everything,None,Major
86e314aa7301cc2802bb4910c07f0957e391ed18,/,/,    kafka-937; fix bug exposed in ConsumerOffsetChecker; patched by Jun Rao; reviewed by Alexey Ozeritskiy,/,/
5f14a69c2e5c21be9b1257e62040e89f400ac2d9,/,/,    kafka-950; Leader election rate may be reported on a non-controller; patched by Jun Rao; reviewed by Sriram Subramanian,/,/
5a084f7be6986ccbe6ede9df0b519d0fd7929d01,/,/,    kafka-951; Leader election rate may be reported on a non-controller; patched by Jun Rao; reviewed by Swapnil Ghike,/,/
cc6027b3279ac5cd8908d01d35511c93716fbe60,/,/,    kafka-947; isr-expiration-thread may block LeaderAndIsr request for a relatively long period; patched by Jun Rao; reviewed by Joel Koshy,/,/
3b470f56b479f618b7e90577f9857b4e25b38c1a,/,/,    kafka-891; NullPointerException in ConsoleConsumer; patched by Colin B.; reviewed by Neha Narkhede and Jun Rao,/,/
731ba9007d4e2fa2f3a5e44f7b30827975fca420,/,/,    kafka-823; merge 0.8 (51421fcc0111031bb77f779a6f6c00520d526a34) to trunk; patched by Jun Rao; reviewed by Jay Kreps,/,/
9ff4e8eb10e0ddd86f257e99d55971a132426605,KAFKA-739,Bug,Handle null values in Message payload,None,Major
c1ed12e44ddebe41dc464683e3d7eeb4e6d39a45,KAFKA-554,New Feature,Move all per-topic configuration into ZK and add to the CreateTopicCommand,None,Major
4f2742d60d16f5ba468aa66d2c3ed7aa37479dce,/,/,    merge from 0.8 and resolve conflicts,/,/
82b11aa0d4bc32c5a351ace3a67cd2d57c9d1e8d,KAFKA-759,Bug,Commit/FetchOffset APIs should not return versionId,core,Minor
218e6a53c1385be897d9f8a3a39baa38b68d7992,KAFKA-771,Bug,NPE in handleOffsetCommitRequest,core,Major
e7edb5e1e933f5535378d546bcf4d8b178d2e69c,KAFKA-631,New Feature,Implement log compaction,core,Major
92f177b309834a9b572bbab33e8f6198316bd156,/,/,    merge 0.8 to trunk and resolve conflicts,/,/
999813821c091adcc5c50d0cb6b8c702473a0a8c,/,/,    Merge remote branch 'origin/0.8' into trunk,/,/
