61f02fa542380e70c837fbc52deac74daec62505,KAFKA-2001,Bug,OffsetCommitTest hang during setup,core,Major
57d38f672bcb85fdb20d8ca3fab9bd60d1bc8965,KAFKA-1986,Sub-task,Producer request failure rate should not include InvalidMessageSizeException and OffsetOutOfRangeException,None,Major
c5d654acb2097eabb1784dcc88145e111a3d037b,KAFKA-1499,New Feature,Broker-side compression configuration,None,Major
616987d196b654486a1261f4eed50e48560e3041,KAFKA-1852,Bug,OffsetCommitRequest can commit offset on unknown topic,None,Major
1cd6ed9e2c07a63474ed80a8224bd431d5d4243c,KAFKA-1755,Bug,Improve error handling in log cleaner,None,Major
0636928d961a6ceaab46d908f9372d913c3e5faf,KAFKA-1865,Bug,Add a flush() call to the new producer API,None,Major
22ff9e943a960a73d2f007b2c52b90e675a61299,KAFKA-1824,Bug,in ConsoleProducer - properties key.separator and parse.key no longer work,tools,Major
687abc98a4600bf90ed7a7acb6fb2a5e6eac2055,KAFKA-1866,Bug,LogStartOffset gauge throws exceptions after log.delete(),None,Major
b56f5973c739072350f3f6bf6efa4eb05bc692bf,KAFKA-1664,Bug,Kafka does not properly parse multiple ZK nodes with non-root chroot,clients,Minor
a864172da53db009607989e2d7a6c0ff1c600995,/,/,    Deleting the ConsumerTest until the issue with the hanging test is resolved; discussed on the mailing list and got several +1s,/,/
e39373d16bc208128d5d6cf0e0672f27f35e3b20,/,/,    kafka-1400; transient unit test failure in SocketServerTest; patched by Jun Rao; reviewed by Ewen Cheslack-Postava and Jiangjie Qin,/,/
ef252dea704192a8055367d22e45f673f5b06e94,/,/,    kafka-1881; transient unit test failure in testDeleteTopicWithCleaner due to OOME; patched by Ewen Cheslack-Postava; reviewed by Jun Rao,/,/
b8904e9614b4c1f11b8487e7a4b88b1e37e1f20b,KAFKA-1953,Sub-task,Disambiguate metrics from different purgatories,purgatory,Major
 ,KAFKA-1962,Sub-task,Restore delayed request metrics,purgatory,Major
10311c138923dcded5d8f57f587c7f7ef1119dac,/,/,    kafka-1984; java producer may miss an available partition; patched by Jun Rao; reviewed by Ewen Cheslack-Postava  Jay Kreps  and Guozhang Wang,/,/
ee1267b127f3081db491fa1bf9a287084c324e36,/,/,    kafka-1984; java producer may miss an available partition; patched by Jun Rao; reviewed by Ewen Cheslack-Postava  Jay Kreps  and Guozhang Wang,/,/
7c82afddc812908f9289ded4e2cb0733b8116a77,KAFKA-1476,Wish,Get a list of consumer groups,tools,Major
5f3eb1cafaecee746641fa43945cc0762635a0bd,/,/,    kafka-1971; starting a broker with a conflicting id will delete the previous broker registration; patched by Jun Rao; reviewed by Neha Narkhede,/,/
41189ea5601837bdb697ade31f55e244abbe6d1c,/,/,    kafka-1971; starting a broker with a conflicting id will delete the previous broker registration; patched by Jun Rao; reviewed by Neha Narkhede,/,/
3f1e0882297a102843dcd17e05f54ddbedb4882a,KAFKA-1757,Bug,Can not delete Topic index on Windows,log,Minor
62c7e0e485b8b7693354c3a0a0bf95af671c93b6,KAFKA-1947,Bug,can&apos;t explicitly set replica-assignment when add partitions,core,Major
bafecc936787576faf111f12cd59cc17c3523e4e,KAFKA-1919,Bug,Metadata request issued with no backoff in new producer if there are no topics,None,Blocker
19031823c15cb3a0e5fcecaaf5de79c09b5300ed,KAFKA-1919,Bug,Metadata request issued with no backoff in new producer if there are no topics,None,Blocker
fbb11549743aa00420e40696f11b48a705dce019,/,/,    Leaner DelayedItem; reviewed by Neha Narkhede and Joel Koshy,/,/
8c1b9325be4adc5065c6dbe3dcdbdccb1887d604,KAFKA-1867,Bug,liveBroker list not updated on a cluster with no topics,None,Major
38346fb106064a10047ecc7cefa634c6f1b09960,/,/,    Minor typo in KafkaConfig; reviewed by Gwen Shapira,/,/
4c8817e3d156416240906dd06a4494386949ba0a,KAFKA-1729,Sub-task,add doc for Kafka-based offset management in 0.8.2,None,Major
cd8f0b87b9b02302b2fce494e04cc367647a2d2c,/,/,    change build version to 0.8.2.1,/,/
45b9e1580c656867c5c81e2ad8f6645c64b83f90,KAFKA-1729,Sub-task,add doc for Kafka-based offset management in 0.8.2,None,Major
f7f8ac1a8864acdbfc52326edc7cbeb9e35f4adf,KAFKA-1914,Sub-task,Count TotalProduceRequestRate and TotalFetchRequestRate in BrokerTopicMetrics,core,Major
8d72816f48d18d61e8ef8b174896c6d177a09a92,KAFKA-1914,Sub-task,Count TotalProduceRequestRate and TotalFetchRequestRate in BrokerTopicMetrics,core,Major
f5684366ef60125c4d799121a6c0adca4744e8ab,/,/,    kafka-1952; High CPU Usage in 0.8.2 release; patched by Jun Rao; reviewed by Guozhang Wang  Ewen Cheslack-Postava and Neha Narkhede,/,/
375b15511a93313fce52442fb7d4eab4492da62e,/,/,    kafka-1952; High CPU Usage in 0.8.2 release; patched by Jun Rao; reviewed by Guozhang Wang  Ewen Cheslack-Postava and Neha Narkhede,/,/
d5fbba633612fd08f15c523362a0c1ff5a121ff2,KAFKA-1960,Bug,.gitignore does not exclude test generated files and folders.,build,Minor
cdf06564458ac384119d21ac8b25a3a7ebe27014,KAFKA-1959,Bug,Class CommitThread overwrite group of Thread class causing compile errors,core,Major
cb40ec2e7a73bdecdfea6c88ffd8e8717b630d0f,KAFKA-1914,Sub-task,Count TotalProduceRequestRate and TotalFetchRequestRate in BrokerTopicMetrics,core,Major
b8be3140b68cb62d908ca78fe280b089ded851b8,KAFKA-1943,Sub-task,Producer request failure rate should not include MessageSetSizeTooLarge and MessageSizeTooLargeException,None,Major
5b949c7b1ad5ab3f71cae6024eea10b59a7ad9b6,KAFKA-1805,Improvement,Kafka ProducerRecord should implement equals,producer ,Minor
eab4f4c9f43e20b3d91bf0e2e9be6b6fd72f0acf,KAFKA-1697,Bug,remove code related to ack&gt;1 on the broker,None,Major
a3d6dcaf1bcc6189c3ef17b63719ae4d12dcb789,KAFKA-1948,Bug,kafka.api.consumerTests are hanging,None,Major
9fe9913e95e1d3e114c74620d8da40f804f71b18,KAFKA-1476,Wish,Get a list of consumer groups,tools,Major
71602de0bbf7727f498a812033027f6cbfe34eb8,KAFKA-1333,Sub-task,Add consumer co-ordinator module to the server,consumer,Major
39cd48de321585ac55c94ec407fede5858f38962,KAFKA-1333,Sub-task,Add consumer co-ordinator module to the server,consumer,Major
0839def4bdbfd9f5939e463f42cfbc81a98a8eff,KAFKA-1925,Sub-task,Coordinator Node Id set to INT_MAX breaks coordinator metadata updates,consumer,Critical
1c6d5bbac672cbf49591aed0889510b10e3285fa,KAFKA-1915,Improvement,Integrate checkstyle for java code,None,Minor
f1ba4ff87e60a6dc06fb3d16e84fa94f8c4a7d9e,KAFKA-1729,Sub-task,add doc for Kafka-based offset management in 0.8.2,None,Major
75a286e4308831203cc7e1d4748bdab504e8a1f3,KAFKA-1760,Sub-task,Implement new consumer client,consumer,Major
0699ff2ce60abb466cab5315977a224f1a70a4da,KAFKA-1760,Sub-task,Implement new consumer client,consumer,Major
7130da90a9ee9e6fb4beb2a2a6ab05c06c9bfac4,KAFKA-1861,Bug,Publishing kafka-client:test in order to utilize the helper utils in TestUtils,None,Major
11ec9bf5a5f150e5c172f88bb3e60b197ee9df5a,KAFKA-1861,Bug,Publishing kafka-client:test in order to utilize the helper utils in TestUtils,None,Major
96ce96dc959dd827ae1f70a17e89e05b91b6ba58,KAFKA-1729,Sub-task,add doc for Kafka-based offset management in 0.8.2,None,Major
f689e9b1e361cdf47e9966567631c06f614e446d,KAFKA-1902,Bug,fix MetricName so that Yammer reporter can work correctly,core,Blocker
2a1e3d4510e8fadb0cad0cb7290baf54aae39c23,KAFKA-1902,Bug,fix MetricName so that Yammer reporter can work correctly,core,Blocker
0f6cc0a058bbd2736f1e638448fc64b58a9f6b41,KAFKA-1818,Improvement,Code cleanup in ReplicationUtils including unit test,replication,Trivial
0b171dee1fca16595f635bc9991056712e9e3b1a,KAFKA-1885,Improvement,Allow test methods in &quot;core&quot; to be individually run from outside of the IDE,system tests,Major
4aa3dab3de088096461941353ba27cb37f1bd9d1,KAFKA-1883,Bug,NullPointerException in RequestSendThread,core,Major
995d0d369363ef3ad7cf43980746c52768b4df2e,KAFKA-1109,Bug,Need to fix GC log configuration code  not able to override KAFKA_GC_LOG_OPTS,None,Major
ff5cbcacc6fc3217ea41c624fb293adeae7bb672,KAFKA-1896,Bug,Record size funcition of record in mirror maker hit NPE when the message value is null.,None,Major
8cff9119f8d125e55898e2095512b90826522336,KAFKA-1890,Bug,Fix bug preventing Mirror Maker from successful rebalance.,None,Blocker
54e53b7312274a3599229a36caa35f0cd931e341,KAFKA-1891,Bug,MirrorMaker hides consumer exception - making troubleshooting challenging,None,Major
a0852d477ec097bd4efe120c21de020fccf6dc49,KAFKA-1848,Bug,Checking shutdown during each iteration of ZookeeperConsumerConnector,None,Major
fcc2521858efd1bd99e06c319de9489330125a4d,KAFKA-1823,Improvement,transient unit test failure in PartitionAssignorTest,core,Major
0b312a6b9f0833d38eec434bfff4c647c1814564,/,/,    Revert "kafka-1711; WARN Property topic is not valid when running console producer; patched by Joe Crobak; reviewed by Jun Rao",/,/
059b09decf52e774fe7aadc00ca3ef715cd4016c,KAFKA-1879,Improvement,Log warning when receiving produce requests with acks &gt; 1,None,Major
5d648cfdb13dee078bb1b3415f77dbe2d47d7ec4,KAFKA-1876,Bug,pom file for scala 2.11 should reference a specific version,None,Blocker
1e640177f0fcdc9479a7dc9214d11c240f0786c2,KAFKA-1876,Bug,pom file for scala 2.11 should reference a specific version,None,Blocker
07cff763633f20f51310e4f123963aaa0c008b2f,KAFKA-1878,Bug,ProducerFailureHandlingTest.testCannotSendToInternalTopic fails with TimeoutException while trying to fetch metadata for topic,system tests,Major
49d7f8ee1cd96a99f44ac48043db9ad8a5336c7d,KAFKA-1723,Sub-task,make the metrics name in new producer more standard,clients,Blocker
7013b2639eda1ef3e7b2d794bf8513ba40ef34bf,KAFKA-1723,Sub-task,make the metrics name in new producer more standard,clients,Blocker
09234f0e5206b8cb55e89cffc4a0ecfbaafc7f86,/,/,    trivial change to remove -UseCompressedOops option from script,/,/
86a8bc2b024588bbf0b0c6014c401979731fac86,/,/,    trivial change to remove -UseCompressedOops option from script,/,/
5174df53778cb5cb2d6d86e4cec9f3185a2c85db,/,/,    kafka-1864; Revisit defaults for the internal offsets topic; patched by Jun Rao; reviewed by Jeol Koshy  Neha Narkhede  and Gwen Shapira,/,/
7a313999d0d2c846541299ded77b25eddf1bf554,/,/,    kafka-1864; Revisit defaults for the internal offsets topic; patched by Jun Rao; reviewed by Jeol Koshy  Neha Narkhede  and Gwen Shapira,/,/
1769642bb779921267bd57d3d338591dbdf33842,/,/,    kafka-1870; Cannot commit with simpleConsumer on Zookeeper only with Java API; patched by Jun Rao; reviewed by Jeol Koshy and Sriharsha Chintalapani,/,/
1d3fd0f6c875e8162682679fa9299c3dd71a25ed,/,/,    kafka-1870; Cannot commit with simpleConsumer on Zookeeper only with Java API; patched by Jun Rao; reviewed by Jeol Koshy and Sriharsha Chintalapani,/,/
988e695fa294c5e9799509f6313b95e1f96682da,KAFKA-1723,Sub-task,make the metrics name in new producer more standard,clients,Blocker
602d572f6365f80f14e8c968390972ea9767e263,/,/,    kafka-1868; ConsoleConsumer shouldn't override dual.commit.enabled to false if not explicitly set; patched by Jun Rao; reviewed by Jeol Koshy,/,/
17c8bdcbb42d81db47d03091049588238df7e3c6,/,/,    kafka-1868; ConsoleConsumer shouldn't override dual.commit.enabled to false if not explicitly set; patched by Jun Rao; reviewed by Jeol Koshy,/,/
45697ed6c6132475b5dd4dd0069a2a192a75d329,KAFKA-1499,New Feature,Broker-side compression configuration,None,Major
1c8f89bc73ec1844371c812215b255db037e24a5,KAFKA-1499,New Feature,Broker-side compression configuration,None,Major
a611178408cf8497054ff015caba18cfcff70a60,KAFKA-1723,Sub-task,make the metrics name in new producer more standard,clients,Blocker
a643be62afb23bca15ed2e88db9e76cb0ebfa906,/,/,    change build version to 0.8.2.0,/,/
bfb2da3c82ab01f5914d5559ee196d5aa977b17c,/,/,    trivial change to add byte serializer to ProducerPerformance; patched by Jun Rao,/,/
d4629df1c25efe06a9e54ed96375884c5de69442,/,/,    trivial change to add byte serializer to ProducerPerformance; patched by Jun Rao,/,/
e79ebdfe222288f2c5d997ba7e7c5e18c8c514ed,KAFKA-1854,Improvement,Allow the JIRA username and password to be prompted during patch submission,None,Major
4e584deeb652d9bc0b606f710e2bb137392f6f5f,/,/,    kafka-1711; WARN Property topic is not valid when running console producer; patched by Joe Crobak; reviewed by Jun Rao,/,/
432d397af8a1d4467fe8041bcff8790864010a80,KAFKA-1841,Bug,OffsetCommitRequest API - timestamp field is not versioned,core,Blocker
688e38ce45a7358a1e0bb359aa9b1a698a841619,KAFKA-1723,Sub-task,make the metrics name in new producer more standard,clients,Blocker
9b6744d3ae1587444b91e76cc5bdeb9d35f96760,KAFKA-1723,Sub-task,make the metrics name in new producer more standard,clients,Blocker
828b808f98afcd0c670d144af07dc14fcf743edc,/,/,    kafka-1797; (missed parametric in a few files) add the serializer/deserializer api to the new java client; patched by Jun Rao,/,/
6f4dea9dbce5cc9f69a917182981b41a56a98a85,/,/,    kafka-1797; (missed parametric in a few files) add the serializer/deserializer api to the new java client; patched by Jun Rao,/,/
8d5d459049b495d8196ed29ff6c760cb04699914,KAFKA-1819,Bug,Cleaner gets confused about deleted and re-created topics,None,Blocker
14779dddb6a9bb3aefbaa825a62874f89bb47d2c,KAFKA-1819,Bug,Cleaner gets confused about deleted and re-created topics,None,Blocker
ad4883a0cd5afc4219e28cdafbd98576eeaee2d1,KAFKA-1836,Bug,metadata.fetch.timeout.ms set to zero blocks forever,clients,Minor
b1b80860a01cc378cfada3549a3480f0773c3ff8,KAFKA-1070,Bug,Auto-assign node id,None,Major
e52a6181bf0969f315ac0f0d325eac34d2b4a6ee,/,/,    kafka-1851; OffsetFetchRequest returns extra partitions when input only contains unknown partitions; patched by Jun Rao; reviewed by Neha Narkhede,/,/
f88db16d15ff8a1883b7aed3c60eefa64faa764c,/,/,    kafka-1851; OffsetFetchRequest returns extra partitions when input only contains unknown partitions; patched by Jun Rao; reviewed by Neha Narkhede,/,/
a93ef199b2375c422e35d82ac7aa3a2fdacc1e74,/,/,    kafka-1797; (addressing Manikumar Reddy's comment) add the serializer/deserializer api to the new java client; patched by Jun Rao; reviewed by Manikumar Reddy and Neha Narkhede,/,/
f71933ef103dc6af70152cf9915f27a9e4c1128f,/,/,    kafka-1797; (addressing Manikumar Reddy's comment) add the serializer/deserializer api to the new java client; patched by Jun Rao; reviewed by Manikumar Reddy and Neha Narkhede,/,/
f82518a85001307334132056fe32c28b452cf48b,KAFKA-1512,New Feature,Limit the maximum number of connections per ip address,None,Major
367ee76c08ecac376198bf1dc05820589055641b,KAFKA-1512,New Feature,Limit the maximum number of connections per ip address,None,Major
fec9f32dafaaada396a045569c20e625e2a114e3,/,/,    kafka-1797; (delta follow-up patch) add the serializer/deserializer api to the new java client; patched by Jun Rao; reviewed by Neha Narkhede,/,/
517503db2616531b08ee4d08d39c0e1c0bd19e97,/,/,    kafka-1797; (delta follow-up patch) add the serializer/deserializer api to the new java client; patched by Jun Rao; reviewed by Neha Narkhede,/,/
50b734690a93e58030f69cede8d0a84d1e3f5461,/,/,    kafka-1797; (follow-up patch) add the serializer/deserializer api to the new java client; patched by Jun Rao; reviewed by Jay Kreps,/,/
f32e5ce247eb07ce33cfcb876771293e8a2eacdc,/,/,    kafka-1797; (follow-up patch) add the serializer/deserializer api to the new java client; patched by Jun Rao; reviewed by Jay Kreps,/,/
4471dc08b64809f3cdcbff6b8c830e13df87b117,/,/,    kafka-1642; (followup patch) [Java New Producer Kafka Trunk] CPU Usage Spike to 100% when network connection is lost; patched by Ewen Cheslack-Postava; patched by Ewen Cheslack-Postava; reviewed by Jun Rao,/,/
53329583a871ac2027c21979a81dbe0e3bbed4ff,/,/,    kafka-1642; (followup patch) [Java New Producer Kafka Trunk] CPU Usage Spike to 100% when network connection is lost; patched by Ewen Cheslack-Postava; patched by Ewen Cheslack-Postava; reviewed by Jun Rao,/,/
79d16dc36d005bcdab2fe6d8fef31540821785ea,KAFKA-1624,Bug,bump up default scala version to 2.10.4 to compile with java 8,None,Major
10c6dec34dae8820bf7ce24839c938135f9a9189,KAFKA-1650,Improvement,Mirror Maker could lose data on unclean shutdown.,None,Major
84521872d18dd90aff6eb47d470893f64749783f,KAFKA-1824,Bug,in ConsoleProducer - properties key.separator and parse.key no longer work,tools,Major
92d1d4cd31e1045f0e000e8d2d777c73f7529743,/,/,    kafka-1797; add the serializer/deserializer api to the new java client; patched by Jun Rao; reviewed by Neha Narkhede,/,/
03ad248226a4ffc7236ac4ffeeb3a4d125d92efe,/,/,    kafka-1797; add the serializer/deserializer api to the new java client; patched by Jun Rao; reviewed by Neha Narkhede,/,/
ae0bb84fa7e599774cd984196dc62b3dc84b13ca,KAFKA-742,Bug,Existing directories under the Kafka data directory without any data cause process to not start,config,Major
523b36589e942cb99a95debd2c45e795ae533d08,/,/,    kafka-1813; Build fails for scala 2.9.2; patched by Anatoly Fayngelerin; reviewed by Jun Rao,/,/
0ef631bc694d0c6071450c43501ca319a58859f4,/,/,    kafka-1815; ServerShutdownTest fails in trunk; patched by Chris Cope; reviewed by Jun Rao,/,/
e8ffbd0fee0bc715ad0fe6c9afe85715f84d8e51,KAFKA-1812,Bug, Allow IpV6 in configuration with parseCsvMap,None,Minor
2801629964882015a9148e1c0ade22da46376faa,KAFKA-1650,Improvement,Mirror Maker could lose data on unclean shutdown.,None,Major
4fc74958e3569f6179c11fddace99b674c81f370,KAFKA-1807,Improvement,Improve accuracy of ProducerPerformance target throughput,tools,Minor
09e2fd651e0a98a96107f0ee1087c785a54b4e20,KAFKA-1173,Improvement,Using Vagrant to get up and running with Apache Kafka,None,Major
3cc10d5ff9bf73cff2045685f89d71fee92a41f4,KAFKA-1720,Bug,[Renaming / Comments] Delayed Operations,None,Major
 ,KAFKA-1583,Bug,Kafka API Refactoring,None,Major
7e9368baf2e1cd457293b815a665e5d3e4418dfb,/,/,    kafka-1803; UncleanLeaderElectionEnableProp in LogConfig should be of boolean; patched by Dave Parfitt; reviewed by Jun Rao,/,/
15f9e2762d32a0345a5ca13a1e981be646856b41,/,/,    kafka-1801; Remove non-functional variable definition in log4j.properties; patched by Raman Gupta; reviewed by Jun Rao,/,/
723fa4c40d2d04a8557ef9a0ae1626e56f30a9a3,KAFKA-328,Bug,Write unit test for kafka server startup and shutdown API ,None,Major
b24f9c0890302a5149aaaf26dc933bd0a842f1be,/,/,    kafka-1798; ConfigDef.parseType() should throw exception on invalid boolean value; patched by dokovan; reviewed by Jun Rao,/,/
bd212b7a90deaf7f565d620e1aaf9a137f9a0796,/,/,    kafka-1799; ProducerConfig.METRIC_REPORTER_CLASSES_CONFIG doesn't work; patched by Manikumar Reddy; reviewed by Jun Rao,/,/
74bc8860c3c3d582f88581fc7d9edffdfa2dc3a5,/,/,    kafka-1799; (add missing test file) ProducerConfig.METRIC_REPORTER_CLASSES_CONFIG doesn't work; patched by Manikumar Reddy; reviewed by Jun Rao,/,/
8a719e037201e343e22a3d2479651e781ddaccc1,/,/,    kafka-1799; ProducerConfig.METRIC_REPORTER_CLASSES_CONFIG doesn't work; patched by Manikumar Reddy; reviewed by Jun Rao,/,/
4408f487ae911e29dbc6ef4d94010a6fad702109,KAFKA-1783,Bug,Missing slash in documentation for the Zookeeper paths in ZookeeperConsumerConnector,consumer,Trivial
834b6419806750ff555e8ffd104caa420004e84e,/,/,    kafka-1667; topic-level configuration not validated; patched by Dmytro Kostiuchenko; reviewed by Jun Rao,/,/
9f8b8dad2b7ad31c9595f559f6d9e7d07d2f696d,KAFKA-1580,Bug,Reject producer requests to internal topics,core,Critical
72601f783e24217734a3923c6318e12a0f600d0f,KAFKA-1624,Bug,bump up default scala version to 2.10.4 to compile with java 8,None,Major
409c367ceb5f9eae395cb346dd3fa02b8ee8ee70,KAFKA-1654,Improvement,Provide a way to override server configuration from command line,core,Major
f0fd70929a1ad607aa1fbf6ed9b40b16ab95b807,KAFKA-1770,Bug,The description of UnknownTopicOrPartitionException in doc is not accurate.,None,Major
457744a820d806e546edebbd8ffd33f6772e519f,/,/,    kafka-1481; Stop using dashes AND underscores as separators in MBean names; patched by Vladimir Tretyakov; reviewed by Joel Koshy and Jun Rao,/,/
1c7d783dd648d0e691ad80cb1357c52d3f0af11a,/,/,    kafka-1743; ConsumerConnector.commitOffsets in 0.8.2 is not backward compatible; patched by Manikumar Reddy; reviewed by Jun Rao,/,/
fbecd489cd469c102aa42cc12fef58bb8596c92a,/,/,    kafka-1743; ConsumerConnector.commitOffsets in 0.8.2 is not backward compatible; patched by Manikumar Reddy; reviewed by Jun Rao,/,/
6f4b8a10115a7373917cf2a55b74aa8a14c547b9,/,/,    kafka-17693; javadoc should only include client facing packages; patched by Jun Rao; reviewed by Neha Narkhede,/,/
00dfa89260a3ddc7809b4626176114622a42024c,/,/,    kafka-17693; javadoc should only include client facing packages; patched by Jun Rao; reviewed by Neha Narkhede,/,/
117a02de06bab60e179345d6cd82d56e5b725189,/,/,    kafka-1481; Stop using dashes AND underscores as separators in MBean names; patched by Vladimir Tretyakov; reviewed by Joel Koshy and Jun Rao,/,/
7e1907e32bfc3f88cc311aa474fe360c72dfa4ef,/,/,    kafka-1721; Snappy compressor is not thread safe; patched by Ewen Cheslack-Postava; reviewed by Jun Rao,/,/
26ad54c109db9eca01df926255017ece3eb65645,/,/,    kafka-1721; Snappy compressor is not thread safe; patched by Ewen Cheslack-Postava; reviewed by Jun Rao,/,/
8bd57381c4f000565881028582a6a1b2a3a07d4d,/,/,    kafka-1642; [Java New Producer Kafka Trunk] CPU Usage Spike to 100% when network connection is lost; patched by Ewen Cheslack-Postava; reviewed by Guozhang Wang and Jun Rao,/,/
7d89867c05a7cca6e76cc48c47f8e703d68a9a43,/,/,    kafka-1642; [Java New Producer Kafka Trunk] CPU Usage Spike to 100% when network connection is lost; patched by Ewen Cheslack-Postava; reviewed by Guozhang Wang and Jun Rao,/,/
de6d4e4f00aae019df8171ed79c95605c73e4af5,KAFKA-1764,Bug,ZookeeperConsumerConnector could put multiple shutdownCommand to the same data chunk queue.,None,Major
ca2cf97a6b151566f091a5dd016b93dfdaf87628,KAFKA-1764,Bug,ZookeeperConsumerConnector could put multiple shutdownCommand to the same data chunk queue.,None,Major
8c35030e4d24e603e5dbd53862ca6ae4fe59b4e9,KAFKA-1764,Bug,ZookeeperConsumerConnector could put multiple shutdownCommand to the same data chunk queue.,None,Major
d99af88eafefbfd1c537a64f8107cd9041346015,KAFKA-1764,Bug,ZookeeperConsumerConnector could put multiple shutdownCommand to the same data chunk queue.,None,Major
91f8ce7eff5c62c619454ad9d67415878805f600,/,/,    kafka-1733; Producer.send will block indeterminately when broker is unavailable; patched by Marc Chung; reviewed by Jun Rao,/,/
2cd9ae74544efe049393e1a6bf60533aea956d7d,KAFKA-1762,Bug,Update max-inflight-request doc string,None,Major
383ac3e198d6af6f3eb40ab7a42fc73f2f1b4a36,KAFKA-1742,Bug,ControllerContext removeTopic does not correctly update state,None,Blocker
53160bb07c9f77ed21f486ed448aff0277c139b0,KAFKA-1742,Bug,ControllerContext removeTopic does not correctly update state,None,Blocker
9b3da9fbfd60e3a0482ec7bd615dc9806cd9941c,KAFKA-1739,Bug,Remove testComplexCompressDecompress in MessageCompressionTest,None,Major
f20e5108a271e1fc37ca6752773efa74e2fef67f,/,/,    kafka-1738; Partitions for topic not created after restart from forced shutdown; patched by Jun Rao; reviewed by Neha Narkhede,/,/
80eb04f994963c1c6b5e3f0e8742b81ff140fc65,/,/,    kafka-1738; Partitions for topic not created after restart from forced shutdown; patched by Jun Rao; reviewed by Neha Narkhede,/,/
cbdcd5f108d783e9d0e758fbf0d8479968db3a68,KAFKA-1746,Bug,System tests don&apos;t handle errors well,system tests,Major
06e1a6552e2c1de08c185359f3114eb12e61cfae,KAFKA-1747,Bug,TestcaseEnv improperly shares state between instances,system tests,Major
4bb020212aa0260a750b69dc18856cf25c1e7011,KAFKA-1706,Improvement,Adding a byte bounded blocking queue to util.,None,Major
58e3f99e244d6c4b9ad4166cc5fcf75561d87dab,/,/,    kafka-1733; Producer.send will block indeterminately when broker is unavailable; patched by Marc Chung; reviewed by Jun Rao,/,/
2ec356fa903bc65026bef9f6c1b35dd182dbe48d,KAFKA-1647,Bug,Replication offset checkpoints (high water marks) can be lost on hard kills and restarts,None,Critical
1ed9cf6d03603518d950f7e9a5f122c4ed5d7cee,KAFKA-1647,Bug,Replication offset checkpoints (high water marks) can be lost on hard kills and restarts,None,Critical
89831204c092f3a417bf41945925a2e9a0ec828e,KAFKA-1583,Bug,Kafka API Refactoring,None,Major
9be9a80d0c794efb0be9a23908b286e1650f6a95,KAFKA-1732,Bug,DumpLogSegments tool fails when path has a &apos;.&apos;,tools,Minor
20f5b01feacd1e95d558073b7be511cb82888b3e,KAFKA-1732,Bug,DumpLogSegments tool fails when path has a &apos;.&apos;,tools,Minor
5e071cd2502fec73cd1b060dae7995eeb2d52465,KAFKA-1719,Improvement,Make mirror maker exit when one consumer/producer thread exits.,None,Major
43cb192b59ab676d35c38f9144fbc98a954a11d3,KAFKA-1719,Improvement,Make mirror maker exit when one consumer/producer thread exits.,None,Major
a75a295437d8ba41bf52f596f670d51330773c41,KAFKA-1725,Bug,Configuration file bugs in system tests add noise to output and break a few tests,tools,Minor
caf4787e505a637d5a643eccba0aa3d5c6b965d7,KAFKA-1725,Bug,Configuration file bugs in system tests add noise to output and break a few tests,tools,Minor
12ce4b1e1e0e6ec7fd3585baf3ed531ecc16a5d9,KAFKA-1725,Bug,Configuration file bugs in system tests add noise to output and break a few tests,tools,Minor
e402c7be723e5f189a8f2b4f91a28f3b26ea9112,/,/,    kafka-1711; WARN Property topic is not valid when running console producer; patched by Joe Crobak; reviewed by Jun Rao,/,/
b77099626e8fc258abed67dc10b2816347ba0f2b,/,/,    kafka-1700; examples directory - README and shell scripts are out of date; patched by Geoffrey Anderson; reviewed by Jun Rao,/,/
35f589bb4654b49035c27780717f560e74400444,KAFKA-1641,Bug,Log cleaner exits if last cleaned offset is lower than earliest offset,None,Major
cda1f73d0498d66aafc8c6e57f84e0cd3c69928a,/,/,    kafka-1727; Fix comment about message format; patched by Muneyuki Noguchi; reviewed by Jun Rao,/,/
c2dadda3acf1391ebac586c4b66f1845f7ff6cff,KAFKA-1653,Bug,Duplicate broker ids allowed in replica assignment,tools,Major
e8923ae33ac90170381d8c4a59a5eb810ee9f36d,KAFKA-1653,Bug,Duplicate broker ids allowed in replica assignment,tools,Major
a6170d4f6da8d8f853219078a22f4d7b636bd221,/,/,    changed release version prior to candidate release,/,/
